Currency,Title,Date
ILS,"Jordan's King Abdullah warns of 'massive conflict' if Israel annexes West Bank. Monarch says his country is considering all options, including cancelling the 1994 Wadi Araba peace treaty",May 16 2020
ILS,Palestinians excluded from Israeli Covid vaccine rollout as jabs go to settlers - Human rights groups accuse Israel of dodging obligations to millions in occupied territories who may wait months for vaccination,Jan 04 2021
ILS,Israel's top court rules for removal of settler homes from Palestinian land,Aug 28 2020
ILS,Israel offers aid to Lebanon after deadly explosion in Beirut,Aug 05 2020
KZT,Kazakhstan abolishes death penalty,Jan 03 2021
KZT,Deadly 'unknown pneumonia' outbreak in Kazakhstan is probably undiagnosed COVID-19,Jul 12 2020
KZT,China warns of 'unknown pneumonia' more deadly than coronavirus in Kazakhstan,Jul 10 2020
KZT,Kazakhstan denies Chinese government report that country has ‘unknown pneumonia’ outbreak more deadly than Covid-19,Jul 11 2020
KZT,"Kazakhstan summons Chinese ambassador in protest over article ""Why Kazakhstan is eager to return to China”",Apr 15 2020
KZT,China warns of ‘unknown pneumonia’ more deadly than coronavirus in Kazakhstan,Jul 10 2020
KZT,"Kazakhstan’s foreign ministry summoned the Chinese ambassador on Tuesday to protest over an article saying the country was keen to become part of China, the ministry said.",Apr 15 2020
KZT,Police in Kazakhstan detained dozens of protesters who were calling for the release of political prisoners in line with a resolution passed by the European Parliament. Government opponents were attempting their first protest since the resolution called for the European Union to prioritize rights,Mar 01 2021
KZT,Kazakhstan spies on citizens’ HTTPS traffic; browser makers fight back,Dec 20 2020
KZT,Kazakhstan government is intercepting HTTPS traffic in its capital | This marks the third time since 2015 that the Kazakh government is mandating the installation of a root certificate on its citizens' devices.,Dec 08 2020
KZT,"Kazakhstan on Sunday imposed a second round of nationwide restrictions to counter a huge surge in coronavirus cases since the previous lockdown, which has overwhelmed the oil-rich country's healthcare system",Jul 06 2020
KZT,Stunning 45-ft 'Ice Volcano' Forms in Kazakhstan from Underwater Springs,Feb 10 2021
KZT,Deadlier than Covid-19? China warns of unknown pneumonia in Kazakhstan,Jul 10 2020
KZT,ISS Crew lands safely in Kazakhstan,Apr 18 2020
KZT,Kazakhstan's foreign ministry summoned the Chinese ambassador on Tuesday to protest over an article saying the country was keen to become part of China,Apr 15 2020
KZT,Deadlier than Covid-19? China warns of unknown pneumonia in Kazakhstan,Jul 10 2020
KZT,Kazakhstan denies reports of 'unknown pneumonia' outbreak more deadly than Covid-19,Jul 11 2020
KZT,Coronavirus: Kazakhstan denies 'unknown pneumonia' reports but has imposed second national lockdown,Jul 14 2020
KZT,Kazakhstan denies reports by China of pneumonia deadlier than coronavirus,Jul 11 2020
KZT,ISS crew lands in Kazakhstan after more than 200 days,Apr 18 2020
KZT,Kazakhstan combines coronavirus and pneumonia statistics,Jul 18 2020
KZT,Kazakhstan denies reports of 'unknown pneumonia' outbreak more deadly than Covid-19,Jul 12 2020
KZT,Kazakhstan summons Chinese ambassador in protest over article,Apr 15 2020
KZT,Ex-president's party in Kazakhstan to retain power in national election,Jan 11 2021
KZT,Kazakhstan adopts new alphabet with Turkish input,Feb 06 2021
KRW,"New York state has more coronavirus cases than France or South Korea as infections soar to 15,168",Mar 23 2020
KRW,"South Korea to implement ""Green New Deal"" after ruling party's election win - Plan includes large-scale investments in renewable energy, a carbon tax, the phase out of coal financing by public institutions, and supporting workers' transition to green jobs",Apr 20 2020
KRW,"North Korea blows up joint liaison office with the South in border town of Kaesong, S Korean officials say",Jun 16 2020
KRW,"Over 100 Coronavirus Cases in South Korea Have Now Been Linked to One Guy’s Night Out Clubbing - on May 1, a 29-year-old man visited five bars and clubs in Itaewon, one of Seoul’s most popular nightlife districts.",May 13 2020
KRW,Gay men in South Korea are being hunted on dating apps after ‘palpable homophobia’ grows amid coronavirus resurgence,May 13 2020
KRW,South Korea unveils $43 billion plan for world's largest offshore wind farm,Feb 06 2021
KRW,Emergency meeting held in South Korea after Kim Jong Un's sister threatens military action,Jun 15 2020
KRW,"South Korea: Seoul mayor missing, his phone turned off, search underway",Jul 10 2020
KRW,South Korea raised age of consent for sex to 16 from 13 as it seeks to strengthen protection for minors following accusations existing law on sex crimes was too weak...adults who have sex with under-16-year-olds will be prosecuted for child sexual abuse or rape regardless of any alleged consent.,May 13 2020
KRW,"South Korea recorded more deaths than births in 2020 for the first time ever, raising fresh alarm in the country which already has the world's lowest birth rate.",Jan 05 2021
KRW,"Germany will test 200,000 people a day for coronavirus in bid to replicate South Korea's success in slowing the outbreak",Mar 31 2020
KRW,"Coronavirus: Trump asked South Korea for equipment in return for business deals, Seoul says",Mar 25 2020
KRW,"Kim Jong Un's sister warns the US to scrap future military exercises with South Korea if ""it wants a good night's sleep for the next four years""",Mar 16 2021
KRW,"Founder of secretive Christian sect at center of South Korea's largest outbreak of COVID-19 infections arrested for allegedly hiding crucial information from contact-tracers and other offenses...linked to more than 5,200 coronavirus infections, or 36% of South Korea's total cases.",Aug 02 2020
KRW,"South Korea: Kim Jong Un has executed citizens, shut down capital to stop COVID-19 spread",Nov 28 2020
KRW,"Universal basic income gains support in South Korea after COVID | The debate on universal basic income has gained momentum in South Korea, as the coronavirus outbreak and the country's growing income divide force a rethink on social safety nets.",Sep 29 2020
KRW,‘Super-spreader’ church at centre of South Korea’s coronavirus outbreak sued for £66m,Jun 25 2020
KRW,South Korea: Almost all university students want tuition refunds over COVID-19,Apr 22 2020
KRW,Suicides among women in Japan and South Korea have soared during the Covid pandemic,Dec 21 2020
KRW,"North Korea is about to drop cigarette butts, trash, and 12 million propaganda leaflets onto South Korea in its latest psychological-warfare move",Jun 24 2020
KRW,North Korean Ambassador Who Vanished In Italy Is Now Living In South Korea Under The Protection Of The South Korean Government,Oct 08 2020
KRW,Coronavirus: South Korea closes schools again after biggest spike in weeks,May 30 2020
KRW,South Korea’s Virus Spike Was Traced to Gay Bars. Then the Scapegoating Began: When increased infections were tracked back to gay bars in Seoul - the result of a couple of careless individuals - conservatives looked to blame the whole LGBT community.,May 19 2020
KRW,International reactions to projected Biden victory in US presidential election,Nov 08 2020
KRW,3 new mutated COVID-19 strains detected in South Korea,Aug 11 2020
KWD,Kuwait Just Appointed 8 Female Judges in a Historic First,Jul 11 2020
KWD,North Korea's acting envoy to Kuwait has defected to South Korea: lawmaker,Jan 26 2021
KWD,Wear a mask or face jail in Kuwait and Qatar,May 18 2020
KWD,"In Kuwait, women launch their own #MeToo movement",Feb 09 2021
KWD,"Coronavirus in Kuwait: Three years in jail, 10,000 KD fine for breaching curfew",Mar 22 2020
KWD,"UN warns of Yemen famine; no aid from Saudis, UAE, Kuwait",Sep 16 2020
KWD,North Korea's acting envoy to Kuwait has defected to South Korea,Jan 26 2021
KWD,North Korea's acting envoy to Kuwait defects to South Korea,Jan 27 2021
KWD,"Saudi Arabia to reopen airspace, land border to Qatar, says Kuwait",Jan 05 2021
KWD,Kuwait CID arrests Bangladesh MP for human trafficking,Jun 08 2020
KWD,Kuwait Puts Citizens Before Expats as Vaccine Push Stirs Anger - BNN Bloomberg,Feb 21 2021
KWD,"Kuwait's ruler, Sheikh Sabah Al Ahmad Al Sabah, has died aged 91",Sep 30 2020
KWD,Kuwait supermarkets pull French products over Prophet Muhammad cartoons,Oct 27 2020
KWD,Kuwait may soon normalize relations with Israel,Sep 20 2020
KWD,Three Gulf states reach out to Israel for help battling COVID-19 pandemic: UAE and Bahrain have been in touch with Ramat Gan’s Sheba hospital for months; now a third country — likely Kuwait — has asked for help installing telemedicine facilities,May 11 2020
KWD,Kuwait retail co-ops remove French products over Prophet cartoon,Oct 26 2020
KWD,‘Idol worship’ in famous PUBG video game sparks fury in Kuwait and Saudi Arabia,Jun 08 2020
KWD,"Kuwait Airways grounds 7 Pakistani pilots, 56 engineers",Jun 28 2020
KWD,US army opens probe into black market sale of pork in Kuwait,Dec 22 2020
KWD,Kuwait: Ministry of Education to sack 417 expats,Feb 02 2021
KWD,Kuwait election sees two-thirds of parliament lose seats,Dec 07 2020
KWD,'Like sardines': Migrant workers suffering in Kuwait's desert detention camps,May 16 2020
KWD,Kuwait Projects $40 Billion Deficit As Infighting Delays Reform,Jan 31 2021
KWD,Kuwait retail co-ops remove French products over Prophet cartoon,Oct 26 2020
KWD,"Kuwait’s government quits, deepening political deadlock",Jan 13 2021
LYD,"Erik Prince, the former head of the security contractor Blackwater Worldwide and a prominent supporter of Donald Trump, violated a United Nations arms embargo on Libya by sending weapons to a militia commander who was attempting to overthrow the internationally backed government",Feb 20 2021
LYD,Blackwater founder Erik Prince accused of helping evade U.N. Libya sanctions,Feb 22 2021
LYD,"The water supply for residents living in the Libyan capital city Tripoli, has been intentionally cut off since Monday, amid the proliferation of the coronavirus pandemic, Libya’s United Nations humanitarian coordinator said on Friday.",Apr 11 2020
LYD,UN report says Erik Prince violated arms embargo against Libya: report,Feb 24 2021
LYD,"President Abdel Fattah Sisi says Egypt has a legitimate right to intervene in Libya, orders army to prepare",Jun 21 2020
LYD,France wants talks with NATO allies to discuss Turkey’s increasingly “aggressive” and “unacceptable” role in Libya,Jun 16 2020
LYD,"Germany exports millions in arms to Libya war belligerents, despite embargo",May 18 2020
LYD,Nato continues to ‘turn a blind eye’ to Turkey’s increasingly brazen illicit arms deliveries to Libya,Jul 17 2020
LYD,One Of Russia's Most Advanced Missiles Systems Captured In Libya,May 20 2020
LYD,The United States Smuggled A Russian-Made Pantsir Air Defense System Out Of Libya: Report,Jan 28 2021
LYD,US military: Russian mercenaries planted land mines in Libya,Jul 16 2020
LYD,Russian mercenaries take control of Libya's largest oil field,Jul 04 2020
LYD,Photos Confirm Presence of Russian Warplanes in Libya,May 27 2020
LYD,French Navy intercepts Turkish ship carrying weapons to Libya,Mar 30 2020
LYD,US imposes sanctions on individuals & company ‘contributing to instability in Libya’ 9 years after bombing the country for 7 months straight.,Aug 07 2020
LYD,"Germany approves over €1 billion in arms deals to Middle East | Last year, the German gov't signed off on weapons exports to countries involved in the deadly conflicts in Yemen and Libya. Germany is among the world's top 5 weapons exporters.",Jan 04 2021
LYD,Seventeen bodies found in new Libya mass graves | Libya,Nov 09 2020
LYD,Sudanese men hired as shopping mall security guards ‘tricked' into fighting in Libya civil war,Nov 04 2020
LYD,Foreign fighters were meant to leave Libya this week. A huge trench being dug by Russian-backed mercenaries indicates they plan to stay,Jan 23 2021
LYD,UN horrified by reports of at least eight mass graves discovered in Libya,Jun 12 2020
LYD,UN chief expresses shock at discovery of mass graves in Libya,Jun 14 2020
LYD,"A Bangladeshi who allegedly heads an international human trafficking gang was arrested Monday, police said, after the retaliatory killing of 30 migrants following the murder of a smuggler in Libya",Jun 02 2020
LYD,US accuses Russia of deploying fighter jets in Libya,May 27 2020
LYD,Libya 'one hell of a mess' as civil war spirals into international free-for-all,Jul 17 2020
LYD,The United States Smuggled A Russian-Made Pantsir Air Defense System Out Of Libya,Jan 30 2021
MYR,"Malaysia: No more prison, only rehab for drug abusers and addicts under new law",Feb 20 2021
MYR,"Malaysia won't extradite Uighurs to China and will allow them to go to a third country if needed, minister says",Sep 05 2020
MYR,Malaysia’s government has apologised after its advice for women to wear makeup and not nag their husbands during the coronavirus lockdown,Apr 01 2020
MYR,Dutch government to sue Russia over MH17 shootdown - The Dutch government says it will file a lawsuit against Russia at the European Court of Human Rights over the downing of Malaysia Airlines passenger flight MH17 over eastern Ukraine six years ago.,Jul 11 2020
MYR,Malaysia seizes record haul of crystal meth worth $26.2 million,Dec 14 2020
MYR,"Malaysia detains 60 Chinese nationals, 6 vessels for trespassing",Oct 11 2020
MYR,"Mosque religious cluster in Malaysia now up to 40,000 likely infected by Covid-19, says health official",Apr 05 2020
MYR,Rohingya targeted in Malaysia as Covid-19 stokes xenophobia,May 24 2020
MYR,"Chinese TV network names US's Coronavirus Task Force member Dr. Anthony Fauci, Malaysia's Health D-G Dr. Noor Hisham Abdullah, and New Zealand's Health D-G Dr. Ashley Bloomfield as the top three doctors in the world for their approach in handling the Coronavirus pandemic.",Apr 16 2020
MYR,Malaysia bans Muslims from using FaceApp,Jul 06 2020
MYR,Malaysia is selling 'halal' hand sanitiser to combat coronavirus - and it does not work,Mar 26 2020
MYR,"Malaysia’s medical glove factories, which make most of the world’s critical hand protection, are operating at half capacity just when they’re most needed",Mar 25 2020
MYR,"Ex al-Qaeda leader warns of militant attacks on French citizens as Malaysia, Indonesia tighten security",Nov 05 2020
MYR,Two US warships in South China Sea during China-Malaysia stand-off,Apr 22 2020
MYR,US bans palm oil imports from Malaysia’s Sime Darby over forced labor: It is the third US Customs and Border Protection import ban this year related to suspected forced labor in Malaysia,Dec 31 2020
MYR,Back from the dead? Stem cells give hope for revival of Malaysia's extinct rhinos,Aug 13 2020
MYR,Malaysia reports another COVID-19 fatality linked to religious gathering; death toll rises to 15,Mar 24 2020
MYR,North Korea to cut Malaysia ties over extradition of citizen to US,Mar 19 2021
MYR,Malaysia arrests Bangladeshi migrant who criticised government on TV. Malaysian authorities say they have arrested a Bangladeshi man who criticised on television the country's treatment of undocumented migrants during the coronavirus pandemic.,Jul 26 2020
MYR,Malaysia detects five generations of Covid-19 cases linked to mosque cluster; Malaysia's Health Ministry has detected five generations of positive Covid-19 cases that were linked to the tabligh gathering in the Seri Petaling Mosque last month,Mar 29 2020
MYR,The wearing of face masks will be made compulsory starting Aug 1 in Malaysia,Jul 24 2020
MYR,Malaysia warns of more coronavirus cases as it traces guests of Islamic event,Mar 22 2020
MYR,"Six Dead, Nearly 50,000 Evacuated In Malaysia Floods",Jan 09 2021
MYR,Malaysia detains Chinese vessels for trespassing in territorial waters,Oct 12 2020
MYR,"‘We attack,’ Indonesia & Malaysia declare in bid to shield palm oil industry from critics: a “black campaign” announced against the EU and Indonesian NGOs calling for less cutting of rainforests and greater sustainability",Mar 03 2021
MUR,"A ship that has leaked more than 1,000 tonnes of oil in pristine waters off the Mauritius coast appeared to be breaking apart Saturday",Aug 16 2020
MUR,"Satellite images show oil spill disaster unfolding in Mauritius: ""We will never be able to recover""",Aug 11 2020
MUR,Thousands protest in Mauritius over dolphin deaths after oil spill,Aug 30 2020
MUR,"Japan is proposing manually wiping down mangrove trees to remove from their roots any oil that was spilled from a grounded Japanese freighter off Mauritius in the Indian Ocean, a source familiar with the matter said Saturday.",Aug 30 2020
MUR,Dead dolphins on Mauritius shore after oil spill,Aug 27 2020
MUR,Sea life around Mauritius dying as Japanese tanker oil spill spreads,Aug 12 2020
MUR,The captain of the ship that spilled hundreds of tonnes of oil off the coast of Mauritius has been arrested.,Aug 19 2020
MUR,Dying mother dolphin struggles to save baby in Mauritius lagoon after oil spill,Aug 29 2020
MUR,Special Report: Explosive Documents Reveal BP Behind Toxic Mauritius Oil Spill,Jan 08 2021
MUR,"Mauritius has requested that Japan pay a total of 1.34 billion Mauritian rupees, equivalent to around 3.6 billion yen ($34 million), to support the local fishermen community affected by an oil leak from a Japanese freighter that ran aground in July, according to a Mauritian government document.",Sep 03 2020
MUR,"Mauritius declares a state of environmental emergency due to an oil spill from a Japanese ship - the ship was carrying 3,800 tonnes of fuel when it struck a reef at an internationally-listed conservation site",Aug 09 2020
MUR,£250mill PPE contract for NHS awarded with no tender to company run by Minister's adviser registered in Mauritius. PPE doesn't meet required standards so cannot be used.,Aug 10 2020
MUR,"At least 17 dead dolphins have been found on the coast of Mauritius, prompting debates about whether a recent oil spill was to blame.",Aug 27 2020
MUR,Japan criticized for weak presence in responding to Mauritius oil leak: The government has been criticized by environmental groups for its weak presence and slow response in tackling an oil spill disaster caused by a Japanese freighter that ran aground off Mauritius in the Indian Ocean last month.,Aug 21 2020
MUR,Disastrous oil spill in Mauritius partly caused by crew seeking mobile phone signal,Dec 19 2020
MUR,Mauritius in ‘environmental crisis’ as oil leak from grounded ship threatens coastline,Aug 09 2020
MUR,Mauritius on the brink of environmental disaster after oil tanker spill.,Aug 08 2020
MUR,'Massive poisonous shock': Scientists fear lasting impact from Mauritius oil spill,Aug 14 2020
MUR,Thousands protest in Mauritius over dolphin deaths after oil spill,Aug 31 2020
MUR,"Boat That Spilled Over 1,000 Tonnes Of Fuel In Mauritius Breaks In Half",Aug 16 2020
MUR,Mauritius declares emergency as stranded oil ship leaks oil.,Aug 09 2020
MUR,Mauritius declares emergency as stranded ship spills fuel,Aug 08 2020
MUR,"Protest in Mauritius over oil spill, dozens of dead dolphins. Leaked fuel from a Japanese tanker fouled protected wetlands area and small island that was bird and wildlife sanctuary.",Aug 30 2020
MUR,At least 24 dead dolphins wash up on Mauritius beach after oil spill.,Aug 28 2020
MUR,"Satellite images show oil spill disaster unfolding in Mauritius: ""We will never be able to recover""",Aug 09 2020
MXN,"Mexico closes US border in Arizona to stop July 4th visitors, citing COVID-19 fears",Jul 04 2020
MXN,Mexico's solution to the Covid-19 educational crisis: Put school on television,Aug 29 2020
MXN,Some of Mexico's wealthiest residents went to Colorado to ski. They brought home coronavirus,Mar 21 2020
MXN,Biden to send 4 million AstraZeneca vaccine doses to Canada and Mexico,Mar 19 2021
MXN,Mexico says two women may have had non-consensual surgery in U.S. detention center,Oct 13 2020
MXN,Mexico approves landmark cannabis legalization bill in landslide vote,Nov 22 2020
MXN,Demonstrators burn Trump effigies in Mexico during border wall protest,Nov 02 2020
MXN,Mexico moves closer to becoming the world's largest legal cannabis market,Mar 07 2021
MXN,Furious crowd forces armed police officers to release men arrested for kissing on a beach in Mexico,Mar 01 2021
MXN,Canadian senator co-signed order barring international travel during pandemic — then went to Mexico,Jan 09 2021
MXN,A New Investigation Alleges That Some Of Mexico’s Largest Tequila Brands Are Laundering Money For Drug Cartels,Jun 10 2020
MXN,Mexico's highest-ranking bishop backs Pope's support of civil unions for gay couples,Dec 12 2020
MXN,Revealed: Monsanto owner and US officials pressured Mexico to drop glyphosate ban,Feb 17 2021
MXN,Mexico City outlaws gay conversion therapy,Jul 25 2020
MXN,"Record numbers of an endangered species of turtle have hatched on a beach in northern Mexico, believed to be the result of reduced human activity during the coronavirus pandemic.",Oct 29 2020
MXN,"The names of women victimized by violence were painted on metal barriers hastily erected around Mexico’s national palace late on Saturday, ahead of a major women’s march as activists turned the fencing into a makeshift billboard for their movement",Mar 08 2021
MXN,Schools in Mexico will not reopen at start of academic year - Nationwide educational television to be broadcast.,Aug 04 2020
MXN,"Mexico’s President Says Legal Marijuana Is About Freedom, As Legislation Advances In Congress – “Things do not have to be prohibited, prohibited, prohibited,” the president said. “If something is authorized, if something is allowed, well, act responsibly. Have confidence in people and seek do good.”",Nov 27 2020
MXN,Mexico Passes Bill to Legalize Cannabis,Mar 11 2021
MXN,"Women charged police lines and threw Molotov cocktails at officers in Mexico City during protests demanding the legalization of abortion in the majority Roman Catholic country. The protesters, clad in the green bandanas that have become the symbol of the pro-choice movement in Latin America",Sep 30 2020
MXN,"Mexico's President Has No Interest in Bailing Out Big Companies and Banks, Says the Poor Must Be Rescued",Mar 25 2020
MXN,Mexico border towns try to stop Americans crossing amid Covid-19 fears,Jul 09 2020
MXN,"'Shocking': wilderness the size of Mexico lost worldwide in just 13 years, study finds",Sep 19 2020
MXN,"Mexico: A US embassy staffer drugged, sexually abused at least 23 women and kept almost 400 photos, videos of his activities on iCloud account",Oct 29 2020
MXN,"The number of mammoth skeletons found at Mexico City airport construction site raises to 200, making it the world's largest find of mammoth bones",Sep 05 2020
NPR,"Mount Everest is Visible From Kathmandu, Nepal for First Time in Living Memory",May 21 2020
NPR,Muslims in Nepal hold anti-China protest to condemn Uyghur genocide,Nov 24 2020
NPR,UK Police have appealed to motorists for dashcam footage of roads where a missing diplomat was known to regularly jog. Richard Morris was the former UK Ambassador to Nepal has been missing since 6 May.,May 18 2020
NPR,"After India, China is now breaching the borders of Nepal",Sep 24 2020
NPR,"Endangered tigers have made a remarkable comeback in five countries - The number of wild tigers is on the increase in Bhutan, China, India, Nepal and Russia, a decade on from the launch of an ambitious scheme to double the population of the species.",Jul 30 2020
NPR,"Tourists - four men and two women from France, Turkey, Ukraine, the United States and Nepal - found isolating from coronavirus in a cave in India",Apr 21 2020
NPR,Nepal has banned two Indian climbers and their team leader for six years from mountaineering in the country after an investigation found they had faked their 2016 climb up Mt Everest.,Feb 12 2021
NPR,"Nepal has plunged into a political crisis and renewed instability after President Bidhya Devi Bhandari dissolved parliament at the request of Prime Minister KP Sharma Oli and announced general elections would be held in April and May next year, more than a year ahead of schedule",Dec 25 2020
NPR,All-Nepali winter first on K2 - Mountaineers from Nepal do near impossible: first ever winter ascent of the world’s second-highest mountain,Jan 17 2021
NPR,China's state TV's deleted social media post claiming entire Mt Everest continues to draw flak in Nepal,May 11 2020
NPR,Four children killed in blast after playing with abandoned bomb in Nepal,May 02 2020
NPR,"India announces supply of coronavirus vaccines to six countries (Bhutan, Maldives, Bangladesh, Nepal, Myanmar and Seychelles) under grant assistance",Jan 20 2021
NPR,"China asks Afghanistan, Nepal to be like 'iron brother' Pakistan at a four-country meet - viewed as a strategy to alienate India in the South Asian region",Aug 07 2020
NPR,India cases pass China; Nepal reports 1st death,May 17 2020
NPR,China funding anti india protests at Indo-Nepal border,Sep 04 2020
NPR,Mount Everest ‘grows by nearly a metre’ as China and Nepal agree on new height,Dec 09 2020
NPR,Covid-19 vaccines arrive in Nepal from India,Jan 22 2021
NPR,‘It’s as if there’s no Covid’: Nepal defies pandemic amid a broken economy | Global development,Feb 16 2021
NPR,"45 Chinese nationals in Nepal demand flights to go home, throw stones.",May 09 2020
NPR,"After claim on Galwan, Nepal and Bhutan, China says 'aggression and expansion not in our genes'",Jul 10 2020
NPR,China and Nepal finally agree on Mount Everest's height after years of dispute,Dec 09 2020
NPR,Chinese kits donated to Nepal stopped midway over quality concerns,Mar 29 2020
