Currency,Title,Date
ARS,"Argentina Legalizes Abortion, a Milestone in a Conservative Region",Dec 30 2020
ARS,Argentina lower house approves landmark bill to legalize abortion,Dec 12 2020
ARS,"'Democracy Has Won': Year After Right-Wing Coup Against Evo Morales, Socialist Luis Arce Declares Victory in Bolivia Election | ""Brothers and sisters: the will of the people has been asserted,"" Morales declared from exile in Argentina.",Oct 20 2020
ARS,"Scientists have unearthed a massive, 98-million-year-old fossils in southwest Argentina. Human-sized pieces of fossilized bone belonging to the giant sauropod appear to be 10-20 percent larger than those attributed to the biggest dinosaur ever identified",Jan 22 2021
ARS,Argentina has passed a new tax on its wealthiest people to pay for medical supplies and relief measures amid the ongoing coronavirus pandemic.,Dec 06 2020
ARS,"Protests sparked in Argentina after s prosecutor frees perpetrators involved in gang-raping a 16 year old girl in Chebut Argentina from jail. The judge classified it as ""Sexual relief"".",Jun 05 2020
ARS,'Millionaire's tax': Argentina passes levy on the super-rich to help pay for Covid response,Dec 08 2020
ARS,"Argentina Passes ""Millionaire's Tax"" to Fund Covid-19 Recovery",Dec 07 2020
ARS,HIV: Second person to naturally cure infection discovered in Argentina,Mar 19 2021
ARS,International reactions to projected Biden victory in US presidential election,Nov 08 2020
ARS,Argentina to allow medicinal marijuana to be grown at home,Nov 15 2020
ARS,Brazilian women head to Argentina to avoid abortion ban,Jan 10 2021
ARS,"During Argentina's dictatorship, the regime ""disappeared"" and killed some 30,000 opponents. One of them was Omar Marocchi. An alleged perpetrator, a former military commander, has been tracked down in Berlin",Jul 26 2020
ARS,Argentina's health minister resigned late Friday after it emerged that friends of his had been able to skip the line for a Covid-19 vaccination. Health Minister Gines Gonzalez Garci stepped down after President Alberto Fernandez called on him to quit in the wake of the scandal,Feb 21 2021
ARS,Argentina to allow medicinal marijuana to be grown at home,Nov 16 2020
ARS,"Argentina's lower house approves draft legalizing abortion in most cases, responding to long-sought demands from women's rights activists",Dec 12 2020
ARS,Free Medical Marijuana Will Be Available to the Uninsured in Argentina,Nov 19 2020
ARS,'Everything is burning': Argentina's delta fires rage out of control,Aug 02 2020
ARS,Covid: Argentina imposes new tax on wealthiest,Jan 30 2021
ARS,Argentina's Federal Intelligence Agency has called for an investigation into former president Mauricio Macri for allegedly spying on more than 400 journalists. Dozens of foreign journalists appeared on a list of people to be investigated in relation to the G20 and World Trade Organization summits,Jun 08 2020
ARS,"In Argentina, nearly half in poverty as coronavirus deepens economic crisis",Oct 02 2020
ARS,Germany rejects Argentina's claim on Falklands recognition,Jan 24 2021
ARS,'Everything is burning': Argentina's delta fires rage out of control,Jul 31 2020
ARS,Total solar eclipse 2020: The Moon's shadow will race across Chile and Argentina on December 14.,Dec 14 2020
ARS,UK bars Korea from selling FA-50 fighter jets to Argentina,Nov 02 2020
BHD,"Priti Patel under fire over tour of Bahrain police station where human rights activists were tortured: ‘How can the Home Office accept that I was tortured at this site, then send the Home Secretary there for a photo opportunity?’ victim asks.",Dec 13 2020
BHD,"Following UAE, Bahrain to normalize relations with Israel",Sep 12 2020
BHD,Bahrain says it won't allow imports from Israeli settlements,Dec 06 2020
BHD,"Israel, UAE and Bahrain sign US-brokered normalisation deals.",Sep 16 2020
BHD,US Navy sailors named in Bahrain sex-trafficking scandal report,Jun 26 2020
BHD,Israel says it expects Bahrain and Oman to follow UAE in formalising ties,Aug 17 2020
BHD,"Israel, Bahrain to normalize relations in another blow to Palestinians",Sep 12 2020
BHD,Two Israelis wounded from Gaza rockets fired during UAE-Bahrain peace signing,Sep 16 2020
BHD,Bahrain prosecutes woman for destroying Hindu idols,Aug 19 2020
BHD,Israel says it expects Bahrain and Oman to follow UAE in formalising ties,Aug 17 2020
BHD,‘Shoved aside’: Fiji set to lose top job on UN rights body in global power struggle - Country’s expected ascension to human rights council presidency is being challenged by a China-backed bid by Bahrain,Dec 30 2020
BHD,‘From friends to family’: Israel and Bahrain establish diplomatic relations,Oct 19 2020
BHD,Bahrain Expected to Normalize Relations with Israel,Sep 12 2020
BHD,Sudan formally recognizes Israel in United States-brokered deal to become third Muslim country to recognize Israel after United Arab Emirates and Bahrain,Oct 24 2020
BHD,"Spain’s former king received alleged €1.7m donation from ruler of Bahrain, Swiss probe shows",May 03 2020
BHD,Bahrain has become the second nation in the world to grant an emergency-use authorization for the coronavirus vaccine made by Pfizer and its German partner BioNTech.,Dec 05 2020
BHD,Bahrain Announces Normalization With Israel,Sep 12 2020
BHD,Bahrain follows UAE to normalise ties with Israel,Sep 12 2020
BHD,Bahrain reportedly stops Iran-backed militants planning attacks,Sep 21 2020
BHD,"Iran Guards warn of 'harsh revenge' against Bahrain by Bahrainis, Palestinians over Israel deal",Sep 13 2020
BHD,Iran warns the UAE and Bahrain they will bear 'severe consequences' after they signed an historic peace deal with arch-foe Israel,Sep 17 2020
BHD,Three Gulf states reach out to Israel for help battling COVID-19 pandemic: UAE and Bahrain have been in touch with Ramat Gan’s Sheba hospital for months; now a third country — likely Kuwait — has asked for help installing telemedicine facilities,May 11 2020
BHD,"Israel, UAE, and Bahrain flags displayed on the walls of Jerusalem.",Sep 17 2020
BHD,Palestinians quit Arab League role over UAE-Bahrain-Israel deal,Sep 23 2020
BHD,Israel says it expects Bahrain and Oman to follow UAE in formalising ties,Aug 17 2020
BWP,"350 elephants drop dead in Botswana, some walking in circles before doing face-plants",Jul 11 2020
BWP,"‘Filthy bloody business:’ Poachers kill more animals as coronavirus crushes tourism to Africa. In Botswana, at least six rhinos have been poached since the virus shut down tourism there. In the northwest South Africa, at least nine rhinos have been killed since the virus lockdown.",Apr 27 2020
BWP,Hundreds of elephants dead in mysterious mass die-off - Botswana’s government is yet to test the remains of the dead animals in what has been described as a ‘conservation disaster’,Jul 02 2020
BWP,330 elephant deaths in Botswana caused by toxic blooms in waterholes linked to climate change,Sep 23 2020
BWP,"Toxins made by microscopic algae in water caused the previously unexplained deaths of hundreds of elephants in Botswana, wildlife officials say.",Sep 22 2020
BWP,Nerve agent fear as hundreds of elephants perish mysteriously in Botswana,Jul 02 2020
BWP,It's not poachers killing elephants in Botswana. That worries conservationists.,Jul 21 2020
BWP,"Hundreds of elephants that died mysteriously in Botswana's famed Okavango Delta probably succumbed to natural toxins, the wildlife department said Friday. Authorities have so far ruled out anthrax, as well as poaching, as the tusks were found intact",Aug 01 2020
BWP,Botswana: Mystery deaths of hundreds of elephants solved - Caused by cyanobacteria,Sep 22 2020
BWP,275 Elephants found dead in Botswana,Jul 04 2020
BWP,"Mystery surrounds the ""completely unprecedented"" deaths of hundreds of elephants in Botswana over the last two months.",Jul 02 2020
BWP,Botswana says toxins in water cause of mysterious elephant deaths,Sep 22 2020
BWP,"As many as 400 elephants have died in Botswana’s Okavango Delta since March, wildlife experts say. Conservationists have questioned the government’s handling of the mass deaths and rejection of assistance to test and investigate.",Jul 08 2020
BWP,Wildlife officials in Zimbabwe say they suspect a bacterial disease is responsible for the deaths of more than 30 elephants since late August. Earlier this year hundreds of elephants were found dead in Botswana from a type of bacterial poisoning.,Sep 30 2020
BWP,Hundreds of elephants mysteriously dead in Botswana,Jul 02 2020
BWP,356 elephants died suddenly in Botswana. The cause is a mystery.,Jul 07 2020
BWP,Botswana investigating mystery deaths of at least 275 elephants,Jul 03 2020
BWP,Toxins in water killed 330 elephants this year: Botswana,Sep 23 2020
BWP,More than 360 elephants die from mysterious causes in Botswana,Jul 03 2020
BWP,Botswana: Mystery elephant deaths caused by cyanobacteria,Sep 23 2020
BWP,Botswana National Lockdown: No Alcohol For The Next 3 Months,Apr 27 2020
BWP,"Botswana, Ghana, Mauritius and Zimbabwe added to European Union blacklist for money laundering and terrorist financing",May 09 2020
BWP,Botswana says it has solved mystery of mass elephant die-off - Elephants may have ingested toxins produced by bacteria found in waterholes,Sep 22 2020
BWP,"Expert warns mystery elephant killer could leave Botswana herd ""decimated""",Jul 11 2020
BWP,Botswana gets first test results on elephant deaths,Jul 11 2020
BRL,The US ambassador to Brazil reportedly asked Brazilian officials to help Trump’s reelection,Aug 02 2020
BRL,"‘We are facing extermination’: Brazil losing a generation of indigenous leaders to Covid-19 - Coronavirus has swept through tribes, killing elders – and inflicting irreparable damage on tribal history, culture and medicine",Jun 22 2020
BRL,"President's 'So what?' as 5,000 die sparks fury in Brazil",May 02 2020
BRL,Brazil's President Jar Bolsonaro Rejects Joe Biden's Offer of $20 Billion To Protect The Amazon Rainforest,Oct 05 2020
BRL,"Armed with spears and bows, dozens of indigenous protesters in Brazil vowed to maintain a roadblock on a key highway through the Amazon until the authorities help them fight against COVID-19 and deforestation. Members of the Kayapo Mekranoti ethnic group have been blocking the road",Aug 21 2020
BRL,"Bolsonaro experiencing Covid-19 symptoms, says CNN Brazil",Jul 07 2020
BRL,"Brazil's Federal Police named Carlos Bolsonaro, son of President Jair Bolsonaro, as an organizer of a criminal scheme that spread fake news. The Supreme Court conducted the investigation",Apr 26 2020
BRL,"Brazil's Bolsonaro calls surging Amazon fires a 'lie', despite data produced by his own government showing that thousands of fires are surging across the region",Aug 12 2020
BRL,"In just 24 hours, Brazil sets a grim new record with almost 35,000 new coronavirus cases",Jun 17 2020
BRL,The Workers' Party (PT) of Brazil will present a formal petition to initiate an impeachment against the far-right President Jair Bolsonaro for his mismanagement in the face of the health crisis that the country is going through due to COVID-19.,May 18 2020
BRL,"Number of coronavirus cases in Brazil is 15 times higher than official data, new national research point out. They estimate over 300,000 people are infected and they fear a catastrophe is coming over the next weeks.",Apr 17 2020
BRL,Covid-19 takes the life of the last male from Brazil’s indigenous Juma tribe,Feb 24 2021
BRL,"Brazil president still telling people to 'ignore lockdown' despite 6,000 coronavirus deaths and nearly 100,000 infected.",May 04 2020
BRL,Brazil's Jair Bolsonaro bizarrely suggests COVID-19 vaccines could turn people into 'crocodiles' or bearded ladies,Dec 20 2020
BRL,Brazil now has the second-highest number of coronavirus cases in the world after US,May 24 2020
BRL,Apple will be forced to sell iPhones with included power adapter in Brazil,Dec 03 2020
BRL,"Brazil expects 110,000 dead due to coronavirus in the state of São Paulo alone.",Apr 18 2020
BRL,"Brazil's Jair Bolsonaro says coronavirus crisis is a media trick - Brazil’s far-right president, Jair Bolsonaro, has accused his political foes and the press of purposefully “tricking” citizens about the dangers of coronavirus, as Latin America braced for a spike in the number of deaths.",Mar 24 2020
BRL,"Brazil announces equal pay for men, women footballers",Sep 04 2020
BRL,"Amazon rainforest plots sold via Facebook Marketplace ads: Parts of Brazil's Amazon rainforest are being illegally sold on Facebook, the BBC has discovered.",Feb 28 2021
BRL,"Seven major European investment firms told Reuters they will divest from beef producers, grains traders and even government bonds in Brazil if they do not see progress in resolving the surging destruction of the Amazon rainforest.",Jun 20 2020
BRL,"'We failed': one scientist's despair as Brazil Covid-19 deaths hit 100,000",Aug 10 2020
BRL,Brazil journalists sue President Bolsonaro for removing mask with COVID-19,Jul 10 2020
BRL,Study finds that Brazil’s Jair Bolsonaro carried out an ‘institutional strategy to spread the coronavirus’,Jan 31 2021
BRL,Brazil: blow to Bolsonaro as judge orders release of expletive-ridden video,May 23 2020
BND,Brunei reports no new COVID-19 cases for 58 straight days,Jul 05 2020
BND,"Andorra, Belgium and The Bahamas to be removed from [UK's] travel corridors list. Brunei and Malaysia will be added to the travel corridors list.",Aug 08 2020
BND,"The son of the enormously wealthy Sultan of Brunei, and fourth in line to the throne, died on Saturday in the capital city Bandar Seri Begawan.",Oct 29 2020
BND,Brunei starts voluntary COVID-19 blood test from today | Borneo Bulletin,May 05 2020
BND,Bruneians mourns as Prince Azim of Brunei is laid to rest,Oct 25 2020
BGN,Protesters in Bulgaria demand prime minister's resignation amid corruption allegations,Sep 10 2020
BGN,"Thousands of people have taken to the streets in cities across Bulgaria on Independence Day, calling on the prime minister and the chief prosecutor to step down over allegations they allowed an oligarchic mafia to seize control of the Balkan country",Sep 24 2020
BGN,Bulgaria: Nationalists honor pro-Nazi general with flowers,Feb 14 2021
BGN,Bulgaria protests enter 100th day as protesters denounce corruption,Oct 19 2020
BGN,Prime Minister of Bulgaria Fined $174 for Not Wearing Mask in Church,Jun 24 2020
BGN,Britain says it stands with Bulgaria against 'malign' Russian activity,Mar 21 2021
BGN,Bulgaria: President Rumen Radev calls for PM Borissov and government to resign amid multiple political scandals and large anti-corruption protests,Jul 12 2020
BGN,"8,000-Year-Old Structures, Medieval Christian Necropolis, Ottoman Slaughter Fire Traces Found in Bulgaria’s Stara Zagora",Nov 27 2020
BGN,Anti corruption protests in Bulgaria enter thirtieth consecutive Day,Aug 09 2020
BGN,Bulgaria expels two Russian diplomats accused of spying,Sep 24 2020
BGN,"Thousands of demonstrators have filled the streets of Bulgaria's capital, Sofia, for the last two weeks, demanding the government resign. Accusations of corruption led to a parliamentary no-confidence vote, which the government survived. But protests continue and are spreading across the country",Jul 24 2020
BGN,"Germany adds parts of Romania, Bulgaria to list of COVID risk areas",Aug 09 2020
BGN,The European Union warned Bulgaria that it risks undermining security in the Balkans if it continues to block EU membership talks for North Macedonia,Dec 09 2020
BGN,"A wave of street protests against corruption have swept Bulgaria in recent days, with demonstrators piling pressure on veteran premier Boyko Borisov to resign over his perceived links with oligarchs. Thousands of Bulgarians gathered for a sixth consecutive evening to chant ""Resign!""",Jul 15 2020
BGN,"France and Netherlands Remain Unsupportive of Romania, Bulgaria and Croatia's Schengen Accession",May 30 2020
BGN,"Anti-government protests in Bulgaria expand to more cities, get support from US embassy",Jul 15 2020
BGN,Bulgaria: Demonstrators present head of government Boiko Borissow resignation ultimatum,Aug 13 2020
BGN,"Coronavirus outbreak amongst police officers in Bulgaria's capital city Sofia results in decision to reduce by about a third the number of police guarding anti-government protests, the Interior Ministry said. August 1 is the 24th consecutive day of the protests in Bulgaria.",Aug 02 2020
BGN,Bulgaria Takes Step Towards Backing Constitutional Changes,Sep 04 2020
BGN,Bulgaria says to block EU accession talks with North Macedonia,Nov 16 2020
BGN,Bulgaria rocked by protests amid coronavirus fears,Jul 15 2020
BGN,Corruption impedes foreign investment in Bulgaria - U.S. State Dept,Sep 15 2020
BGN,"As Eastern Europe shrinks, rural Bulgaria is becoming a ghostland",Jul 22 2020
BGN,Fourth Night of Anti-Government Protests in Bulgaria,Jul 15 2020
BGN,"EU Commissioner for Home Affairs wants Romania, Bulgaria and Croatia to join Schengen",May 09 2020
CLP,"Coronavirus: Chile’s elite scolded for escaping by helicopter for Easter holiday amid outbreak - Interior minister says citizens have ‘moral duty’ to stay home, as wealthy Santiago residents sneak off to coastal enclaves",Apr 11 2020
CLP,"Chilean police throw boy, 16, off bridge during protests | Chile",Oct 04 2020
CLP,"Chile Counts Those Who Died of Coronavirus as Recovered Because They're 'No Longer Contagious,' Health Minister Says",Apr 15 2020
CLP,Chile to Scrap Pinochet-Era Constitution in Landslide Referendum,Oct 26 2020
CLP,International reactions to projected Biden victory in US presidential election,Nov 08 2020
CLP,Chile picks Japan's trans-Pacific cable route in snub to China,Jul 31 2020
CLP,Chile unveils green hydrogen strategy to become world-class exporter,Nov 04 2020
CLP,Jubilation as Chile votes to rewrite constitution,Oct 26 2020
CLP,Chile's indigenous community will have 17 seats reserved for it in the commission charged with rewriting the South American country's constitution following a vote in parliament.,Dec 17 2020
CLP,Scientists investigate possible coronavirus mutation in Chile. An investigation is under way to determine why a remote region in Patagonia reported 20 percent of Chile’s COVID-19 cases.,Oct 12 2020
CLP,Soldiers fired rubber bullets into crowds of protesters in Chile this week as anti-government riots break out in Santiago over lack of help for the poor during lockdown,May 25 2020
CLP,"Chile's environmental protection service said it had slapped a record $6.6 million fine on a Norwegian salmon producer for the 2018 escape of 690,000 antibiotic-fed fish. The fine, handed to salmon farming company Mowiwas the largest ever for an environmental offense in Chile",Aug 22 2020
CLP,Cat birthday party caused covid-19 outbreak in Chile,Jan 17 2021
CLP,"Chile's environmental protection service said it slapped record $6.6 million fine on Norwegian salmon producer for 2018 escape of 690,000 antibiotic-fed fish. The fine was the largest ever for an environmental offense in the South American country.",Aug 23 2020
CLP,Celebrations as Chile votes by huge majority to scrap Pinochet-era constitution,Oct 27 2020
CLP,Communist Party of Chile calls for replacement of Pinochet's constitution,Oct 24 2020
CLP,Total solar eclipse 2020: The Moon's shadow will race across Chile and Argentina on December 14.,Dec 14 2020
CLP,Chile becomes Latin America’s COVID-19 vaccination champion,Mar 15 2021
CLP,"Magnitude 6.8 earthquake strikes off coast of Chile, no tsunami risk",Dec 28 2020
CLP,Jubilation as Chile votes to rewrite constitution,Oct 26 2020
CLP,Chance for Chile to forge new path in vote to scrap Pinochet-era constitution,Oct 23 2020
CLP,Chile police officer sentenced for killing of Mapuche farmer on 'historic day',Jan 30 2021
CLP,Chile's government ordered a mandatory total quarantine for the capital Santiago on Wednesday after a 60 percent spike in coronavirus infections in the previous 24 hours,May 14 2020
CLP,"Covid: Chile's president Sebastián Piñera fined $3,500 for no-mask selfie",Dec 20 2020
CLP,"A wild puma was captured after it was found wandering around the deserted center of Santiago, Chile, in search of food",Mar 25 2020
CNY,Uighur group calls for China to lose 2022 Games over 'genocide',Jul 31 2020
CNY,Newly revealed financial records show Trump owes millions to state-owned bank in China: report,Apr 25 2020
CNY,"China breaching every act in genocide convention, says legal report on Uighurs",Mar 10 2021
CNY,Shenzhen becomes first city in China to ban consumption of cats and dogs,Apr 02 2020
CNY,United States Surpasses China in Coronavirus Cases; Now Leads the World,Mar 27 2020
CNY,U.S. Says China’s Repression of Uighurs Is ‘Genocide’,Jan 20 2021
CNY,Canada votes to recognize China’s treatment of Uighur population as genocide,Feb 23 2021
CNY,"UK officially states China has now broken the Hong Kong pact, considering sanctions",Nov 13 2020
CNY,"Trump told China's president that building concentration camps for millions of Uighur Muslims was 'exactly the right thing to do,' former adviser says",Jun 18 2020
CNY,"World is legally obliged to pressure China on Uighurs, leading lawyers say.",Jul 23 2020
CNY,The U.S. has certified that Hong Kong is no longer politically autonomous from China,May 28 2020
CNY,British Jews Board of Deputies compares China’s treatment of Uighur Muslims to Nazi Germany,Jul 23 2020
CNY,UK declares China in breach of 1984 Hong Kong declaration,Mar 14 2021
CNY,Germany has told China to stop threatening Europe as Merkel hardens her stance towards Beijing,Sep 03 2020
CNY,China asked the WHO to cover up the coronavirus outbreak: German intelligence service,May 10 2020
CNY,US intelligence warned in November that coronavirus spreading in China could be 'cataclysmic event': report,Apr 09 2020
CNY,Boris Johnson's government is reportedly furious with China and believes it could have 40 times more coronavirus cases than it claims,Mar 30 2020
CNY,Zoom says China asked it to censor pro-democracy activists in US and it obeyed,Jun 12 2020
CNY,"Trump is scapegoating the WHO - but failed to confirm a U.S. representative for 3 years: Experts say that left the U.S. without a senior voice in the global health body, surrendering influence to China as it worked to cover up the extent of the COVID-19 epidemic in Wuhan",Apr 21 2020
CNY,Jack Ma and other billionaires go missing in China after criticizing government,Jan 06 2021
CNY,"Trump asked China’s Xi to help him win reelection, according to Bolton book",Jun 18 2020
CNY,Amazon has bought cameras to take temperatures of workers during the coronavirus pandemic from a Chinese firm the United States blacklisted over allegations it helped China detain and monitor Uighurs and other Muslim minorities,Apr 30 2020
CNY,WHO accused of 'carrying China's water' after official refuses to acknowledge Taiwan during bizarre interview,Mar 29 2020
CNY,"China Uses Rape as Torture Tactic Against Uighur Detainees, Victims Say",Feb 12 2021
CNY,Leaked Documents Show How China’s Army of Paid Internet Trolls Helped Censor the Coronavirus,Dec 25 2020
COP,"The rape of Colombia's indigenous children: Indigenous women are often the victims of sexual violence in Colombia, but the gang rape of a young girl by soldiers shocked the country. Unfortunately, it was not an isolated incident",Jul 06 2020
COP,"331 environmental defenders were murdered in 2020, over half of them in Colombia",Mar 03 2021
COP,Fury in Colombia as soldiers admit rape of 13-year-old indigenous girl,Jun 27 2020
COP,Colombia Sees Bouts Of Looting As Coronavirus Fallout Puts People Out Of Work,Jul 18 2020
COP,Child Environmentalist Receiving Death Threats in Colombia,Jan 28 2021
COP,Doctors in Colombia’s capital Bogota have begun denying critical care for elderly COVID-19 patients after the saturation of intensive care units forces them to prioritize the young,Jul 20 2020
COP,Colombia’s Military Killed Three Times More Civilians During FARC War Than Previously Reported,Feb 24 2021
COP,Colombia's FARC admits to killing ex-presidential candidate Alvaro Gomez Hurtado in 1995,Oct 05 2020
COP,Cocaine 'Worth $184M' found in banana boxes sent from Colombia,Feb 22 2021
COP,"Colombia: Protests against police brutality leave 13 dead, over 400 injured",Sep 12 2020
COP,"Colombian President Duque: 'We're not a rich nation, but we tried to do something humanitarian' for migrants - In the last five years, 1.8 million Venezuelans have crossed the border into Colombia, fleeing the incompetent and murderous dictator there",Mar 19 2021
COP,The child environmentalist receiving death threats in Colombia,Jan 27 2021
COP,Coronavirus: Raspberry Pi-powered ventilator to be tested in Colombia,Apr 14 2020
COP,Colombia not only has Covid-19. It also has a bad case of dengue fever.,Mar 23 2020
COP,Colombia ends terrifying week with three massacres in one day (17 dead with a total of 28 people killed within two weeks),Aug 23 2020
COP,Colombia: Indigenous protesters topple conquistador's statue,Sep 18 2020
COP,"Former president of Colombia Alvaro Uribe, now faces house arrest for alleged charges of witness manipulation during a legal proceeding against him.",Aug 05 2020
COP,At least 11 dead in massacres in Colombia,Sep 10 2020
COP,Colombia to grant temporary protection to nearly 1m Venezuelans,Feb 09 2021
COP,"Colombian social leader Carlos Andrés Sánchez Villa, was killed by armed men on road in rural area of Tibú. According to most recent count prepared by Institute for Peace and Development Studies, 84 social activists were murdered in Colombia between January and April 30.",May 06 2020
COP,Colombia will legalize undocumented Venezuelan migrants,Feb 09 2021
