Currency,Title,Date
NPR,Nepal Bans Two Climbers for Faked Everest Summit,Feb 05 2021
NPR,Nepal nationwide protests to call for restoration of monarchy,Dec 06 2020
NPR,Russia to send Nepal up to 25 million Sputnik V vaccine doses: RIA,Jan 13 2021
NZD,"Research finds that New Zealand beat Covid-19 by trusting leaders and following advice. Citizens had a high level of knowledge about coronavirus and how it spread, and compliance with basic hygiene practices and trust in authorities was at nearly 100%.",Jul 24 2020
NZD,"New Zealand secures enough vaccine for all New Zealanders, and six pacific nations",Dec 17 2020
NZD,New Zealand beats Coronavirus for the second time with no active community cases as of today.,Oct 07 2020
NZD,"'Heartbreaking,' Say Global Experts, Alarmed at Signs US Has 'Given Up' Fight to Stop Covid-19: ""I can't imagine what it must be like having to go to work knowing it""s unsafe,"" said one expert in New Zealand. ""It's hard to see how this ends.""",Jun 21 2020
NZD,No active cases and no new cases of Covid-19 in New Zealand,Jun 08 2020
NZD,New Zealand has no Covid-19 patients in hospital and only 21 active cases remain,May 27 2020
NZD,"New Zealand's Deputy Prime Minister shuts down American Covid-19 denier at campaign event: ""We’ve got someone who obviously got an education in America""",Oct 14 2020
NZD,"Jacinda Ardern hits back at Trump: ""Anyone who was following outbreaks around the world would quite easily see New Zealand's nine new cases yesterday didn't compare to the tens of thousands in the United States.""",Aug 18 2020
NZD,New Zealand's Ardern sworn in for second term after landslide win,Nov 06 2020
NZD,New Zealand announces official Travel Warning to New Zealanders in the United States due to the upcoming election and civil unrest,Oct 31 2020
NZD,"After 102 days COVID-free, New Zealand reports it's first cases of community transmission",Aug 12 2020
NZD,"With just 5 cases in the community, New Zealand makes mask use mandatory on public transport.",Nov 16 2020
NZD,New Zealand Prime Minister Says Borders Will Remain Closed to Tourists Until Citizens Are Vaccinated,Jan 31 2021
NZD,No new coronavirus cases for the first time in New Zealand since lockdown,May 04 2020
NZD,"New Zealand Prime Minister Jacinda Ardern: Democracy ""should never be undone by a mob""",Jan 07 2021
NZD,"New Zealand's COVID Response Was So Good, Mortality Is Down From Previous Years",Jan 07 2021
NZD,Christchurch shooting: mosque terrorist sentenced to life without parole - an unprecedented sentence in New Zealand,Aug 27 2020
NZD,"COVID-19 lockdown: New Zealand Health Minister demoted after driving 20km to beach, breaking lockdown rules",Apr 07 2020
NZD,New Zealand's Jacinda Ardern appoints country's first Indigenous female foreign minister,Nov 03 2020
NZD,New Zealand PM Ardern's ratings sky high ahead of election,Jul 27 2020
NZD,New Zealand now has the gayest Parliament in the world.,Oct 18 2020
NZD,New Zealand refuses quarantine-free trips from Australia as Australian Capital Territory joins travel bubble: NZ PM Jacinda Ardern says her country will not open up until Australia records a month without community transmission of Covid-19,Oct 04 2020
NZD,"[New Zealand] Covid-19: 100 days of no community spread, no new cases reported",Aug 09 2020
NZD,New Zealand Prime Minister Jacinda Ardern appears headed for big election win and 2nd term in early vote counting,Oct 17 2020
NZD,New Zealand Government to roll out free period products at schools,Feb 18 2021
NOK,Norway bans hate speech against trans and bisexual people,Nov 12 2020
NOK,Norway to increase carbon tax from $95/tonne to $240/tonne,Jan 12 2021
NOK,"Norway makes its first discovery of highly pathogenic bird flu, H5N8",Nov 28 2020
NOK,Electric cars have reached 61.5% market share in Norway followed by hybrids that make up another 27.4%,Oct 08 2020
NOK,Climate crisis: Norway accused of ‘acting like Trump’ over refusal to set protected Arctic zone in areas where oil firms want to drill,Apr 26 2020
NOK,Norway's Olympic body asks IOC to postpone Tokyo Games until pandemic ends,Mar 22 2020
NOK,China warns Norway against granting Nobel Peace Prize to Hong Kong democracy activists,Aug 29 2020
NOK,Norway Wealth Fund Dumps Oil Stocks Amid $10 Billion Loss,Feb 02 2021
NOK,"World's largest wealth fund blacklists four Canadian firms for emissions - Norway’s $1 trillion sovereign fund said on Wednesday it had excluded four Canadian oil and gas companies from its portfolio for producing excessive greenhouse gas emissions, its first use of that reason to blacklist firms.",May 14 2020
NOK,"In a controversial move, Norway sails frigate into Russian economic zone together with U.K. and U.S. navy ships",Sep 10 2020
NOK,Norway to Decriminalize Personal Drug Use in ‘Historic’ Shift,Feb 20 2021
NOK,481 and counting: Norway’s whaling catch hits four-year high. Norway continues its commercial whaling operation despite the International Whaling Commission placing a global moratorium on commercial whaling in 1982.,Aug 29 2020
NOK,US deploying B-1 bombers to Norway to send a message to Russia,Feb 09 2021
NOK,Norway says Russia behind cyber attack against its parliament,Oct 14 2020
NOK,Norway suspends cruise ship arrivals with 100+ people on board after virus outbreak,Aug 04 2020
NOK,Archaeologists in Norway find rare Viking ship burial using only radar,Nov 11 2020
NOK,"New study warns: We have underestimated the pace at which the Arctic is melting | Over the past 40 years, temperatures have risen by one degree every decade, and even more so over the Barents Sea and around Norway's Svalbard archipelago, where they have increased by 1.5 degrees per decade",Aug 11 2020
NOK,"Norway pledges $1 billion to vaccines against Covid-19, other diseases",May 05 2020
NOK,Norway urges Israel not to annex parts of the West Bank,Jun 03 2020
NOK,Norway police arrest citizen suspected of spying for Russia,Aug 18 2020
NOK,Norway to spend $1.8 billion on world's first full-scale CCS (Carbon Capture and Storage) project,Sep 22 2020
NOK,"From Norway to Canada, the Arctic Ocean is being polluted by tiny plastic fibers from our clothes",Jan 13 2021
NOK,"Norway landslide: At least 10 people injured and 26 missing, police say",Dec 31 2020
NOK,Norway says Russia behind cyberattack against its parliament,Oct 14 2020
NOK,Now Norway is offering drug-free treatment to people with psychosis,Feb 19 2021
OMR,Oman bans single-use plastic bags from Friday,Jan 02 2021
OMR,Cash-strapped Oman plans income tax on wealthy starting 2022 | Income tax would mark a departure from long-standing practice among Gulf Arab states.,Nov 03 2020
OMR,Israeli cargo ship hit by ‘unexplained explosion’ in Gulf of Oman,Feb 27 2021
OMR,Israel says it expects Bahrain and Oman to follow UAE in formalising ties,Aug 17 2020
OMR,Israel and Oman agree to work towards normalization,Aug 18 2020
OMR,Israel says it expects Bahrain and Oman to follow UAE in formalising ties,Aug 17 2020
OMR,"Saudi Arabia, Oman halt international flights, close borders over mutant Covid-19",Dec 22 2020
OMR,"Oman, Indonesia likely next countries to forge ties with Israel",Dec 14 2020
OMR,"Oman sultan creates crown prince post, changes constitution",Jan 12 2021
OMR,Oman supports UAE decision to normalise ties with Israel,Aug 15 2020
OMR,Israel says it expects Bahrain and Oman to follow UAE in formalising ties,Aug 17 2020
OMR,"Oman, Indonesia likely next countries to forge ties with Israel",Dec 14 2020
OMR,Oman tells shoppers to cover knees and shoulders in malls or face jail,Sep 22 2020
OMR,Tehran hard-liners admit Iran attacked Israeli ship off Oman,Mar 03 2021
OMR,U.S. considering blacklist for Yemen's Houthis - Oman foreign minister,Dec 07 2020
OMR,Oman receives 100K Covid Vaccines from India under the Vaccine Maitri program,Feb 01 2021
OMR,Iran test fires cruise missiles in Gulf of Oman and Indian Ocean,Jun 19 2020
OMR,Israel says it expects Bahrain and Oman to follow UAE in formalising ties,Aug 17 2020
OMR,"Oman, also enjoying warming ties with Israel, backs Israel-UAE normalization",Aug 15 2020
OMR,Locusts return to Oman as attention turned to coronavirus,May 10 2020
OMR,Oman suspects four cases of new coronavirus strain,Dec 23 2020
OMR,Netanyahu blames Iran for blast on Israeli-owned ship in Gulf of Oman,Mar 02 2021
OMR,"Saudi Arabia, Kuwait, Oman close borders over new COVID-19 strain",Dec 22 2020
OMR,Oman Sultan's Eldest Son To Succeed Him Under New Law,Jan 13 2021
OMR,"Iranian Missile Strikes Own Ship, Navy Says 19 Killed: Reports say the support ship was too close to a target during an exercise in the Gulf of Oman",May 12 2020
PKR,Pakistan's prime minister calls for rapists to be hanged or castrated after mother gang-raped,Sep 17 2020
PKR,Pakistan army chief says ‘it is time to bury the past’ with India,Mar 20 2021
PKR,"Pakistan approves new anti-rape laws, closing loopholes, abolishing antiquated two-finger testing, setting up special courts for rape cases, and introducing chemical castration as a 'form of rehabilitation' in extreme cases",Dec 16 2020
PKR,Rapists will be chemically castrated in Pakistan under new laws approved by Prime Minister Imran Khan,Nov 27 2020
PKR,"India now as autocratic as Pakistan, worse than Bangladesh: Sweden institute's Democracy Report",Mar 12 2021
PKR,Gurdeep Singh makes history by becoming first Sikh to win elections in Pakistan Senate,Mar 07 2021
PKR,Pakistan meets UN climate change goal a decade ahead of deadline,Jul 14 2020
PKR,"Four arrested over destruction of 1,700 year-old Buddha statue in Pakistan",Jul 20 2020
PKR,Pakistan plane crash: Airbus jet comes down near Karachi airport,May 23 2020
PKR,Pakistan Borrows $1 Billion Chinese Loan To Pay Back $1 Billion Saudi Loan,Aug 07 2020
PKR,Pakistan plants 3.5 million trees in a single day.,Aug 10 2020
PKR,"In ‘landmark decision’, Pakistan approves industrial use of cannabis and hemp",Sep 04 2020
PKR,'Many will starve': locusts devour crops and livelihoods in Pakistan. Farmers faced with worst plague in recent history say they have been left to fend for themselves,May 26 2020
PKR,France ‘deeply shocked’ as Pakistan minister compares Macron to Nazis,Nov 23 2020
PKR,Pakistan opens fire and lobs mortars at forward areas along India,Jun 21 2020
PKR,Pakistan's Me Too Movement Gains Momentum as Teachers at Elite Girls School Face Abuse Accusations,Jul 14 2020
PKR,"As a 'green stimulus', Pakistan sets virus-idled to work planting trees",Apr 30 2020
PKR,Avalanche kills 25 Taliban fighters on route from Pakistan,Mar 16 2021
PKR,"Doctors Are Begging Pakistan to Close Mosques or Risk a Coronavirus Catastrophe; Doctors say it was a huge mistake to bow to religious clerics, who demanded an end to government restrictions right before Ramadan",Apr 24 2020
PKR,"Outcry in Pakistan as police blame woman who was gang raped, for driving at night",Sep 11 2020
PKR,"Religious body in Pakistan says lockdown not applicable to mosques, congregational prayer begins",Apr 16 2020
PKR,Honey production is rising in Pakistan as more trees planted,Jul 15 2020
PKR,International reactions to projected Biden victory in US presidential election,Nov 08 2020
PKR,"An anti-terrorism court in Pakistan has handed death sentences to three men for social media posts deemed insulting to Prophet Muhammad under the country’s blasphemy laws. Fourth accused, a college teacher, sentenced to 10 years in jail for ‘blasphemous’ lecture he delivered in the classroom.",Jan 09 2021
PKR,Rapists to be chemically castrated in Pakistan under proposed sexual violence law,Nov 28 2020
PHP,Philippines poised to lift age of consent for sex from 12 to 16 after decades of lobbying from children’s rights activists,Dec 22 2020
PHP,"""Shoot them dead"": Philippine President Rodrigo Duterte orders police and military to kill citizens who defy coronavirus lockdown",Apr 03 2020
PHP,"The Philippines Will Be ‘in Deep Shit’ if it Follows Trump and Bolsonaro in Reopening, Duterte Says",Jul 10 2020
PHP,"Catholic lawmakers ‘have no basis’ to deny same-sex civil unions after Pope’s historic intervention, says Philippine president",Oct 26 2020
PHP,"Wet markets in China, Indonesia, Thailand, Vietnam, Cambodia and the Philippines are continuing to sell live and dead animals amid the COVID-19 pandemic",May 15 2020
PHP,Philippines protests China green light for its coast guard to fire on foreign vessels,Jan 31 2021
PHP,Philippine authorities seized giant clam shells worth $3.3 million as smugglers turn to the endangered creatures as a substitute for ivory trade.,Mar 06 2021
PHP,Philippine President Duterte tells military to shoot those who criticize the government's actions,Apr 02 2020
PHP,"Senator from Philippines who tested positive for COVID19 violates quarantine protocol, brings wife for caesarean delivery, endangering hospital staffs and patients.",Mar 26 2020
PHP,Execution-style killing of mother and son by off-duty cop sparks outrage in the Philippines,Dec 22 2020
PHP,China 'threatens war' with Philippines as US pledges support to Manila,Jan 31 2021
PHP,"Man who called Philippine president ""crazy"" on Facebook arrested for cyberlibel",May 15 2020
PHP,Japan detects new coronavirus variant from traveler coming from the Philippines,Mar 13 2021
PHP,Philippine Duterte: Face-to-face classes to resume in January 2021. I cannot and will not put to risk the health and lives of our students and teachers,Jul 28 2020
PHP,2 dead after Philippine Police and Drug Enforcement Agents shoot at each other after undercover narcotics operation,Feb 25 2021
PHP,Popular Philippines radio show host ‘Rex Cornello’ shot dead in ambush — Reporters Without Borders has urged the Philippine authorities to appoint a special independent team to investigate yesterday’s “shocking murder” of an investigative radio journalist with a reputation for covering corruption,May 07 2020
PHP,Philippine President Duterte Refuses to Have Vaccine on Camera Because He Wants to Take It in His Butt,Jan 29 2021
PHP,Magnitude 6.3 earthquake strikes south of Philippines' Luzon island,Dec 25 2020
PHP,Court Finds Evidence of Crimes Against Humanity in the Philippines,Dec 20 2020
PHP,Philippines shuts door on new coal power proposals | The Philippines has stopped accepting new proposals for coal-based power projects to encourage investment in other energy sources like natural gas and renewables.,Nov 05 2020
PHP,Philippines wants Taiwan to deport Filipina who posted comments critical of President Duterte on Facebook,Apr 26 2020
PHP,"Philippines orders top broadcaster ABS-CBN to halt operations: The Philippines' telecoms body ordered the country's leading broadcaster ABS-CBN Corp to cease operations on Tuesday (May 5), as a parliament dominated by President Rodrigo Duterte's loyalists dragged its feet over renewing its license.",May 06 2020
PHP,17 out of 96 dead are doctors / nurses in The Philippines. More than 600 medics are in quarantine.,Apr 03 2020
PHP,Rights groups call for investigation into killings of Philippine activists,Mar 08 2021
PHP,Philippines backs Vietnam after China sinks fishing boat,Apr 10 2020
PLN,Denmark and Poland are refusing to bail out companies registered in offshore tax havens,Apr 22 2020
PLN,Poland and Denmark exclude tax haven companies from coronavirus relief schemes,Apr 21 2020
PLN,"France will block firms registered in offshore tax havens from claiming aid from government coronavirus bailout, following similar moves by Denmark and Poland...companies either registered, or controlling subsidiaries, in tax havens ineligible for 110 billion euros ($108 billion) rescue package.",Apr 24 2020
PLN,Three women face jail in Poland for sharing posters of Virgin Mary with an LGBT+ rainbow halo,Nov 06 2020
PLN,Poland delays abortion ban amid nationwide protests,Nov 04 2020
PLN,Polish priests defy bishop amid pedophilia scandal | Priests in the Polish diocese of Kalisz refused to sign letters of loyalty to their bishop after a child abuse cover-up. More and more Catholics in Poland are calling on the Church to properly investigate such crimes.,May 31 2020
PLN,The head of Poland's Roman Catholic Church has said he is asking the Vatican to investigate the cover-up of child sexual abuse by priests.,May 18 2020
PLN,"Germany, Poland and Sweden expel Russian diplomats",Feb 09 2021
PLN,Protests against homophobia break out in Poland,Aug 09 2020
PLN,Protests erupt as Poland adopts near-total ban on abortion,Jan 28 2021
PLN,"""The policeman pinned her head to the pavement"". Demonstrations in defence of LGBTQ activist in Poland meet with police crackdown",Aug 09 2020
PLN,Poland abortion ruling: Protesters block roads across country - the escalation of protests,Oct 27 2020
PLN,Poland to introduce retirement benefits for police dogs and horses,Feb 22 2021
PLN,International reactions to projected Biden victory in US presidential election,Nov 08 2020
PLN,"Some European countries have decided to block businesses linked to offshore tax havens from receiving government-backed coronavirus bailouts. France, Poland, Belgium and Denmark have similar measures designed to exclude some companies from taxpayer-funded relief programs.",May 20 2020
PLN,Nationwide strike launched after Poland abortion ruling,Oct 29 2020
PLN,Poland: Censorship of a political song against the leader of the ruling party on the most iconic State Radio caused nationwide scandal,May 19 2020
PLN,Poland: Thousands protest against abortion law for third straight night,Jan 30 2021
PLN,Poland abortion ruling: Police use pepper spray against protesters,Oct 24 2020
PLN,Thousand of women protesting against Poland’s new abortion laws in cities across the country,Oct 24 2020
PLN,Poland Official Calls AstraZeneca Scare 'Planned Disinformation' As Europe Divides Over Shot,Mar 17 2021
PLN,Police warn of tougher action as thousands join abortion protests in Poland,Oct 29 2020
PLN,"Near-Total Abortion Ban Takes Effect in Poland, and Thousands Protest",Jan 28 2021
PLN,"Poland to accelerate coal phase-out, spend billions on renewable and nuclear energy",Sep 09 2020
PLN,"New mother, 27, dies from complications after contracting coronavirus in Poland — The Polish woman caught coronavirus-related pneumonia a few days after giving birth via Caesarean section, Centrum Medyczne, a hospital in Łańcut in southern Poland, said in a Facebook post.",Mar 24 2020
QAR,"Revealed: 6,500 migrant workers have died in Qatar as it gears up for World Cup | Global development",Feb 23 2021
QAR,Canada Goose Workers Allege Unsafe Working Conditions in Winnipeg Factories. “Before I came to Canada I was in Qatar and then Dubai and it’s the same here in Canada Goose: No humanity.”,Jan 16 2021
QAR,Qatar to allow Pride flags during 2022 World Cup – but will still lock up gay men for having sex,Dec 10 2020
QAR,"Trump senior aide Kushner and team heading to Saudi Arabia, Qatar",Nov 30 2020
QAR,"Emir of Qatar's brother is accused of ordering his staff to kill Americans on US soil, beating his chauffeur to death, going on drug binges and sexually assaulting male prostitute with a pool cue",Jun 21 2020
QAR,"Qatar has made wearing a face mask compulsory for everyone who steps outside their home, with violators facing jail time and fines of up to $55,000",May 15 2020
QAR,David Beckham signs a lucrative £10million deal to be the media-friendly face of 'homophobic' Qatar,Feb 09 2021
QAR,Qatar airport officials could face charges over forced vaginal examinations of women,Oct 31 2020
QAR,Obama called ‘slave’ by Qatar’s ex Emir Hamad bin Khalifa in leaked Gaddafi recording.,Jun 01 2020
QAR,Female domestic workers in Qatar face 'kicking and hair-pulling' as employers confiscate passports | The claims of mistreatment are the latest against the Gulf state which will host the 2022 football World Cup,Oct 24 2020
QAR,Saudi bots continue to push reports of non-existent coup in Qatar,May 15 2020
QAR,Wear a mask or face jail in Kuwait and Qatar,May 18 2020
QAR,"6,500 migrant workers have died in Qatar as it gears up for World Cup",Feb 25 2021
QAR,Qatar airport incident in which women were invasively searched reported to Australian Federal Police,Oct 26 2020
QAR,Qatar subjects 34 women including 18 Australian female passengers to compulsory genital exams in a hunt for the mother of an abandoned newborn at the Doha airport.,Oct 31 2020
QAR,Qatar to prosecute officials over forced exams of women at airport,Oct 31 2020
QAR,Australia seeks Qatar response after female passengers strip-searched,Oct 28 2020
QAR,"Qatar Airways gifting 100,000 healthcare workers with free flights as 'thank you' for fighting coronavirus",May 13 2020
QAR,"Qatar raises minimum wage, lifts curbs on changing jobs",Aug 31 2020
QAR,"Saudi Arabia to reopen airspace, land border to Qatar, says Kuwait",Jan 05 2021
QAR,Qatar says staff who searched Australian women at Doha airport committed 'illegal actions',Oct 31 2020
QAR,Dutch cancel online mission to Qatar due to World Cup worker deaths - DutchNews.nl,Mar 03 2021
QAR,Outrage as women strip searched after abandoned baby discovered at Qatar airport - Doha News,Oct 27 2020
QAR,Qatar's Al Meera removes French products amid growing boycott movement - Doha News,Oct 25 2020
QAR,"Russia's ban from all major sporting events after a doping scandal has been cut to two years by the Court of Arbitration for Sport. The ban still prevents Russia from competing in the Tokyo Olympics and Paralympics, set to be held next year, and football's 2022 World Cup in Qatar.",Dec 18 2020
RON,Romania Cancels Deal With China to Build Nuclear Reactors,May 30 2020
RON,"Romania: 8,500 tonnes of Beirut blast chemical seized in police raids - Romanian police have discovered thousands of tonnes of ammonium nitrate stored illegally and unsafely at sites and storage units across the country",Aug 23 2020
RON,Back from the dead: Race to save Romania's 65 million-year-old fish,Nov 09 2020
RON,International reactions to projected Biden victory in US presidential election,Nov 08 2020
RON,Priests give communion with shared spoon as Romania COVID-19 cases grow,Mar 25 2020
RON,Romania to ban Chinese companies from big infrastructure projects,Mar 05 2021
RON,Romania bans Chinese companies from participating in highway and railway tenders.,Feb 02 2021
RON,"Stolen First Editions by Galileo, Newton Discovered Beneath Floor in Romania",Sep 23 2020
RON,Rare books stolen in London heist found under floor in Romania,Sep 19 2020
RON,Romania Cancels Deal With China to Build Nuclear Reactors: The Bucharest government has told the state company running the Cernvoda plant to find new partners with whom to build two new nuclear reactors.,May 30 2020
RON,"Orban’s ‘Greater Hungary’ map creates waves in neighbourhood - Posted to Facebook by Hungary's PM the map contains large parts of modern Serbia, Romania and Slovakia, as well as the northern half of Croatia.",May 08 2020
RON,Romania To Share Its COVID-19 Vaccine Stockpile With Moldova - Moldovan President,Dec 30 2020
RON,Romania election: Social democrats ahead with 90% of ballots counted,Dec 08 2020
RON,A Jewish community in Romania has urged a New York auction house to halt the sale of a valuable 19th Century memorial register of burials that it believes was stolen during World War II.,Feb 18 2021
RON,Romania found guilty in European Court of Human Rights for refusing to recognise trans men without surgery,Jan 20 2021
RON,Coronavirus in Romania: Health minister resigns,Mar 27 2020
RON,Orthodox Church under fire in Romania after baby dies following baptism,Feb 05 2021
RON,Fire At Romania Hospital Kills Covid Patients.,Nov 17 2020
RON,Romania's Orthodox Church says a series of outdoor posters depicting nurses and doctors on the frontlines of the coronavirus outbreak as saints are blasphemous and an insult to Christian iconography.,Apr 30 2020
RON,'Irreplaceable' stolen books recovered in Romania,Sep 20 2020
RON,Member of Mexican drug cartel caught in Romania and extradited to the US,Feb 23 2021
RON,Iranian ex-judge wanted by Tehran found dead in Romania,Jun 21 2020
RON,Romania's highest scientific body slammed for quoting 5G conspiracies,Sep 02 2020
RON,Romania ravaged by COVID as its doctors work abroad,Dec 21 2020
RON,"Germany adds parts of Romania, Bulgaria to list of COVID risk areas",Aug 09 2020
RUB,UK will veto Donald Trump's bid to let Russia back into the G7 as there is no evidence of 'changed behaviour' since Putin annexed the Crimea,Jun 02 2020
RUB,Doctor in charge of treating Alexei Navalny in Russia after Novichok poisoning dies suddenly and 'very unexpectedly' of suspected heart attack aged 55,Feb 05 2021
RUB,"Nurses have quit en masse from Russia’s top coronavirus hospital in Moscow over poor working conditions and low wages. They reportedly quit because they were denied clean protective gear, food and adequate accommodations, and were not paid bonuses promised by President Vladimir Putin.",Apr 28 2020
RUB,Thousands rally in Russia for 8th straight day of anti-Putin protests,Jul 19 2020
RUB,Russia Moves to Grant Ex-Presidents Lifetime Immunity From Prosecution,Nov 06 2020
RUB,Biden administration tells Russia to free Navalny and protesters in stark departure from Trump era,Jan 26 2021
RUB,Alexei Navalny overtakes Putin as Russia's most mentioned politician on social media,Feb 19 2021
RUB,U.S. Admits That Congressman Offered Pardon to Assange If He Covered Up Russia Links,Sep 19 2020
RUB,Trump and Russia’s Vladimir Putin Spoke Five Times in Just Three Weeks in an ‘Unusual Amount of Communication’,Jun 30 2020
