Currency,Title,Date
RUB,"Leaked notes obtained by the Telegraph say that when Theresa May asked for Trump to take a strong stand after Russia poisoned Sergei Skripal, Trump replied “I’d rather follow than lead.”",Sep 06 2020
RUB,"Trump Pushed CIA to Give Intelligence to Kremlin, While Taking No Action Against Russia Arming Taliban",Jul 09 2020
RUB,German Neo Nazis Are Getting Explosives Training at a White Supremacist Camp in Russia,Jun 07 2020
RUB,Tens of Thousands in Russia Challenge the Kremlin in Second Week of Protests,Jul 26 2020
RUB,Russia reports first human cases of H5N8 bird flu,Feb 21 2021
RUB,"Russia used Trump's naive intelligence sharing to try to assassinate Chechen dissidents in Europe, sources say",Jul 15 2020
RUB,Navalny arrested in Russia,Jan 18 2021
RUB,"Canada does not support Russia's return to G7, which was proposed by U.S. President Trump over the weekend, because Moscow continues to flout international law, PM Trudeau said on Monday.",Jun 02 2020
RUB,"While Americans hoarded toilet paper, hand sanitiser and masks, Russians withdrew $13.6 billion in cash from ATMs: Around 1 trillion rubles was taken out of ATMs and bank branches in Russia over past seven weeks...amount totaled more than was withdrawn in whole of 2019.",Apr 20 2020
RUB,An intelligence bulletin issued by the Department of Homeland Security warns that Russia is attempting to sow doubt about the integrity of the 2020 elections by amplifying false claims related to mail-in voting resulting in widespread fraud.,Sep 04 2020
RUB,US special forces veteran arrested for passing secrets to Russia,Aug 22 2020
RUB,"Russia urges the U.S. to respect Americans’ right to protest and to ‘observe democratic standards’. The Russian Foreign Ministry said, “it’s time for the U.S. to drop the mentor’s tone and look in the mirror”",Jun 06 2020
RUB,"Boris Johnson and Theresa May ignored claims the Kremlin had a “likely hold” over Donald Trump and may have covertly funded Brexit, the former spy Christopher Steele alleges in secret evidence given to MPs who drew up the Russia report.",Jun 23 2020
RUB,"American officials intercepted electronic data showing large financial transfers from a bank account controlled by Russia’s military intelligence agency to a Taliban-linked account, which was among the evidence supporting claim Russia offered bounties for killing US & coalition troops in Afghanistan",Jul 01 2020
RUB,"Doctors in Russia are accusing the government of covering up its coronavirus outbreak, and denying them protective equipment",Mar 21 2020
RUB,Anti-Putin protest in Russia’s far east attracts thousands for a fourth weekend,Aug 02 2020
SAR,"The Trump administration has formally notified Congress that it intends to sell nearly $500 million in precision bombs to Saudi Arabia, a transaction that will fuel criticism from lawmakers who oppose arming the Persian Gulf nation over its record of human rights abuses and role in the war in Yemen",Dec 25 2020
SAR,Biden to Finally Stop Support to Saudi Arabia in Yemen,Jan 24 2021
SAR,"US, Saudi Arabia and Uganda join forces to declare women have no intrinsic right to abortion",Oct 24 2020
SAR,"Loujain al-Hathloul, who fought Saudi Arabia's ban on women driving, appeared before a judge on Wednesday, shaking uncontrollably, to learn she was being sent to terrorism court, her family said.",Nov 26 2020
SAR,"Women activists, political prisoners ‘sexually assaulted, tortured and executed in Saudi Arabia’ jails",Nov 22 2020
SAR,US removes Saudi Arabia from list of worst human traffickers,Jun 26 2020
SAR,"Italy permanently halts arms sales to Saudi Arabia, UAE",Jan 31 2021
SAR,Saudi Arabia rules in favor of woman living independently without permission,Jul 16 2020
SAR,"Iran dismisses Pompeo's assertion of ties between al-Qaeda and Tehran: “No one is fooled. All 9/11 terrorists came from @SecPompeo’s favorite ME destinations (Saudi Arabia); NONE from Iran,” Iran's Foreign Minister Zarif said.",Jan 13 2021
SAR,"The Trump administration has approved another $290 million precision-guided bomb sale to Saudi Arabia, according to a notice to Congress. The sale is in addition to a license the Trump administration recently announced to sell $478 million worth of “smart” bombs to the Saudis.",Dec 30 2020
SAR,"US pauses billions in arms sales to Saudi Arabia, UAE",Jan 28 2021
SAR,Saudi Arabia has been scrubbing its textbooks of anti-Semitic and misogynistic passages,Feb 01 2021
SAR,"Saudi Arabia removes school textbook content that were considered antisemitic, homophobic, sexist, and anti-Israeli, including a unit that condemned homosexuality as something punishable by death.",Dec 16 2020
SAR,"Trump senior aide Kushner and team heading to Saudi Arabia, Qatar",Nov 30 2020
SAR,Saudi Arabia ends death penalty for children and public floggings,Apr 27 2020
SAR,UK selling spyware and wiretaps to 17 repressive regimes including Saudi Arabia and China,Jul 15 2020
SAR,"‘Saudi Arabia is legally responsible for war crimes in Yemen,’ insists Nobel Laureate",Jul 28 2020
SAR,"Saudi Arabia announces discovery of 120,000-year-old human footprints",Sep 17 2020
SAR,"Protesters block trucks at Hamilton shipping firm, want Canada to stop selling arms to Yemen | The transportation company ships light armoured vehicles to Saudi Arabia, aiding ""the brutal Saudi-led war in Yemen, which has killed almost a quarter of a million people,"" says the group",Jan 26 2021
SAR,UK accused of selling arms to Saudi Arabia a year after court ban,Jun 21 2020
SAR,African migrants 'left to die' in Saudi Arabia’s hellish Covid detention centres,Aug 31 2020
SAR,"UK to resume arms sales to Saudi Arabia despite 'possible' war crimes in Yemen, government says",Jul 08 2020
SAR,"Spyware sold by an Israeli private intelligence firm was allegedly used to hack the phones of dozens of Al Jazeera journalists in an unprecedented cyber-attack that is likely to have been ordered by Saudi Arabia and the United Arab Emirates, according to leading researchers",Dec 21 2020
SAR,"Canada calls for global ceasefire, while arming Saudi Arabia in their military campaign against Yemen",Apr 11 2020
SAR,Saudi Arabia donates $500 million to WHO to support international efforts in preventing the spread of coronavirus,Apr 19 2020
ZAR,"South Africa traffics thousands of endangered wild animals to China in ‘corrupt and growing’ trade, investigation finds",May 18 2020
ZAR,"‘Filthy bloody business:’ Poachers kill more animals as coronavirus crushes tourism to Africa. In Botswana, at least six rhinos have been poached since the virus shut down tourism there. In the northwest South Africa, at least nine rhinos have been killed since the virus lockdown.",Apr 27 2020
ZAR,"In Groundbreaking Find, Three Kinds of Early Humans Unearthed Living Together in South Africa",Apr 03 2020
ZAR,"Only a few years ago, scientists estimated there were between 300 and 500 great white sharks in South Africa's False Bay. Now, they have completely disappeared.",May 03 2020
ZAR,Rare sighting of a juvenile Egyptian Vulture in South Africa - the species is thought to be extinct in the country,Apr 27 2020
ZAR,South Africa Makes Strides and Passes Same-Sex Marriage Law,Oct 24 2020
ZAR,"Rich countries block India, South Africa's bid to ban COVID vaccine patents",Feb 05 2021
ZAR,Global warming leads to fish die off in South Africa,Mar 12 2021
ZAR,South Africa has just announced a 21 day national lock down in light of the sudden increase in Covid-19 cases in the country,Mar 24 2020
ZAR,Lions are enjoying the South Africa lockdown so much they're taking naps in the middle of road,Apr 20 2020
ZAR,"In a chilling warning, ISIS has vowed to bring a war to South Africa if it tries to get involved with its north-easterly neighbour, as the global terror network continues to wreak havoc with its insurgency in northern Mozambique.",Jul 08 2020
ZAR,"I’m Avril Benoît, executeve director for Doctors Without Borders USA, an international medical aid organization currently responding to COVID-19 in over 70 countries, including places where coronavirus poses a dire threat to people trapped in overcrowded refugee camps. AMA.",Jun 17 2020
ZAR,US deploys Green Berets to defeat ISIS-linked insurgents accused of beheading children on a new front in south Africa,Mar 21 2021
ZAR,COVID strain in South Africa shows huge resistance to antibodies from original virus,Jan 26 2021
ZAR,COVID-19: UK confirms two cases of another 'more transmissible' variant linked to South Africa | UK News,Dec 24 2020
ZAR,1.5m graves readied as Covid-19 sweeps through South Africa,Aug 02 2020
ZAR,"South Africa records a 60% rise in excess deaths, suggesting a much higher coronavirus-related death toll than officially reported as the worst-affected country in Africa",Jul 24 2020
ZAR,"Giant locust storm likely to attack South Asia farmlands this summer: If media reports are to be believed, a giant locust storm is expected from the Horn of Africa is expected to attack farmlands in South Asia.",Apr 26 2020
ZAR,Rhino poaching in South Africa falls during Covid-19 lockdown,Feb 02 2021
ZAR,South Africa's chief justice unrepentant for linking Covid vaccines to satanism,Dec 12 2020
ZAR,First known patient reinfected with South Africa coronavirus variant is in critical condition,Feb 14 2021
ZAR,"The coronavirus pandemic has found fresh legs around the world, as confirmed deaths pass 600,000 and countries from the U.S. to South Africa to India struggle to contain a surge of new infections. Hong Kong issued tougher new rules on wearing face masks, Spain closed overcrowded beaches",Jul 20 2020
ZAR,U.K. scientists worry vaccines may not protect against coronavirus variant found in South Africa | CBC News,Jan 05 2021
ZAR,Scientists worried about Earth's weakening magnetic field; swarm satellites to investigate - Earth's magnetic field has been weakening across a wide stretch of area for reasons unknown. Scientists have found the magnetic field from Africa to South America to be gradually weakening.,May 26 2020
ZAR,Moderna is designing a new version of its COVID-19 shot to fight the variant first found in South Africa,Jan 26 2021
LKR,"Sri Lanka Police Anally Torture, Whip Gay Men Suspected of Having Sex, Human Rights Watch Says",Oct 23 2020
LKR,Sri Lanka will ban the wearing of the burqa and shut more than a thousand Islamic schools: Government minister,Mar 14 2021
LKR,"India donates first 500,000 doses of vaccine to Sri Lanka",Jan 29 2021
LKR,Sri Lanka returns containers of illegal waste to Britain: Customs,Sep 28 2020
LKR,"Sri Lanka opens borders to tourists, and the very first batch has covid positives",Dec 31 2020
LKR,Sri Lanka Minister who promoted 'Covid syrup' tests positive,Jan 24 2021
LKR,"Over 1,000 get coronavirus at Sri Lanka factory that made masks for US",Oct 10 2020
LKR,Sri Lanka sends waste back to UK,Nov 01 2020
LKR,More than 100 beached whales saved off Sri Lanka,Nov 04 2020
LKR,SRI LANKA: Authorities have destroyed a memorial to the genocide of Tamils built on the Jaffna University campus. This is one of many memorial sites that has been destroyed over the past months,Jan 10 2021
LKR,Earliest evidence of bow and arrow use outside Africa found on Sri Lanka,Jun 13 2020
LKR,"Sri Lanka to ban burqa, shut more than 1,000 Islamic schools",Mar 14 2021
LKR,"Thousands March for Justice in Sri Lanka, Despite Ban",Feb 13 2021
LKR,India donates half a million doses of vaccine to Sri Lanka,Feb 06 2021
LKR,New birth certificate in Sri Lanka: going to remove details on race and religion,Jul 23 2020
LKR,Investigation opened into alleged war crimes by British mercenaries in Sri Lanka,Aug 17 2020
LKR,"Sri Lanka & Maldives eliminate measles and rubella, ahead of 2023 target: WHO",Jul 09 2020
LKR,Sri Lanka to ban burka and other face coverings,Mar 14 2021
LKR,Sri Lanka: Hundreds of plantation workers strike to defend jobs and social rights,Jan 24 2021
LKR,Buddhist Clergy in Sri Lanka ordain tree to protect it from Highway Construction,Feb 11 2021
LKR,Sri Lanka ends forced cremations after Imran Khan's visit,Feb 27 2021
LKR,Sri Lanka: Hundreds of thousands of estate workers strike for a wage rise,Feb 09 2021
LKR,Sri Lanka Supreme Court jails MP and ex-minister for saying courts and lawyers are corrupt.,Jan 14 2021
LKR,Supertanker fire off Sri Lanka under control as navy tows it away,Sep 08 2020
LKR,Sri Lanka to scrap Japan-funded infrastructure projects,Jan 02 2021
SEK,"Sweden 'literally gained nothing' from staying open during COVID-19, including 'no economic gains'",Jul 09 2020
SEK,Sweden has admitted its coronavirus immunity predictions were wrong as cases soar across the country,Nov 14 2020
SEK,Sweden exits coal two years early - the third European country to have waved goodbye to coal for power generation. Another 11 European states have made plans to follow suit over the next decade.,Apr 23 2020
SEK,Sweden's king on coronavirus strategy: 'We have failed',Dec 18 2020
SEK,Sweden sees higher coronavirus death rate than US after refusing lockdown,May 08 2020
SEK,Sweden becomes country with highest coronavirus death rate per capita,May 21 2020
SEK,"Sweden plans to ask European Union to investigate origin of coronavirus, further straining relations with China",Apr 30 2020
SEK,"India now as autocratic as Pakistan, worse than Bangladesh: Sweden institute's Democracy Report",Mar 12 2021
SEK,"Covid-19: Sweden's herd immunity strategy has failed, hospitals inundated",Nov 22 2020
SEK,"Sweden has closed the country’s last coal-fired power station two years ahead of schedule. It becomes the third European country to exit coal completely after Belgium closed its last coal power station in 2016, and Austria ended its final coal-fired energy operations earlier this month.",Apr 28 2020
SEK,"Sweden joins France, Germany in weighing measures against China over Hong Kong",Jul 14 2020
SEK,"Germany, Poland and Sweden expel Russian diplomats",Feb 09 2021
SEK,Sweden shifts away from no-lockdown strategy amid growing case numbers,Oct 19 2020
SEK,"Sweden: Eight people stabbed in suspected terrorist attack, police shoot attacker",Mar 04 2021
SEK,"Sweden admits a 'big failure' to prevent elderly deaths from coronavirus as toll passes 3,000 with 90% of victims over 70.",May 08 2020
SEK,"Sweden is facing increasing pressure to impose a coronavirus lockdown after the number of deaths rose by nearly 20 per cent in a day to 477. The government has so far resisted calls to shut down pubs, restaurants, offices and schools, while gatherings of up to 50 people are still permitted.",Apr 08 2020
SEK,Sweden admits failure to protect elderly in care homes,May 10 2020
SEK,Sweden Says It Sees No Signs Herd Immunity Is Stopping the Virus,Nov 25 2020
SEK,Gothenburg axes twin city agreement with Shanghai as Sweden closes all Confucius Institutes,Apr 24 2020
SEK,International reactions to projected Biden victory in US presidential election,Nov 08 2020
SEK,Sweden bans Huawei and ZTE equipment from use in future 5G network,Oct 21 2020
SEK,The architect of Sweden's no-lockdown plan suggested the strategy was a mistake based on what we now know about the coronavirus,Jun 04 2020
SEK,"Body found in Swedish river is exiled Pakistani journalist, police say — Hussain had escaped Pakistan for Sweden in 2012 following his reporting on corruption in the Pakistani government, which sounded the alarm on forced disappearances and human-rights violations in the region.",May 05 2020
SEK,Sweden records highest number of coronavirus deaths for three weeks,May 14 2020
SEK,Sweden had most COVID-19 deaths per capita in Europe over last week: report,May 20 2020
CHF,"Face shields did not protect people from the coronavirus in an outbreak in Switzerland, but masks did, health officials say",Jul 23 2020
CHF,Supermarket in Switzerland remains fully stocked as residents stay calm during coronavirus pandemic,Mar 25 2020
CHF,Ghana will no longer sell cocoa to Switzerland,Mar 20 2021
CHF,'Practically all full': Switzerland sounds alarm as ICU units reach capacity,Nov 19 2020
CHF,Switzerland quarantines 300 after coronavirus ‘superspreader’ causes outbreak at nightclub,Jun 29 2020
CHF,Switzerland orders a 10-day quarantine of nearly 300 nightclub partiers after 6 people contract COVID-19,Jun 28 2020
CHF,Companies must pay share of rent for employees working from home. This is the first time Switzerland’s highest court has dealt with the topic of rent allowances for employees working from home.,May 27 2020
CHF,Switzerland is holding a referendum on whether to strip the government of its power to impose coronavirus lockdowns,Jan 15 2021
CHF,"Switzerland may ban Hezbollah, which would result in its symbols being banned and its bank accounts and assets seized and frozen within Swiss territory.",Aug 23 2020
CHF,Switzerland has strongly rejected accusations that a deal allowing Chinese officials to enter Switzerland and interrogate Chinese nationals put dissidents at risk,Dec 14 2020
CHF,"Geneva in Switzerland to raise minimum wage to $4,500 a month",Oct 01 2020
CHF,Switzerland issues U.S. travel warning,Jan 17 2021
CHF,Switzerland says Swiss hostage in Mali has been killed,Oct 11 2020
CHF,Switzerland bans exports of PPE to countries outside the EU,Apr 04 2020
CHF,'Insufficient data': Switzerland declines to approve AstraZeneca vaccine,Feb 04 2021
CHF,'Finally' say activists as Swiss same-sex marriage bill advances. Switzerland’s lower house of parliament approved draft legislation on Thursday to let same-sex couples marry in a country that has lagged other parts of western Europe in gay rights.,Jun 12 2020
CHF,China slams Switzerland for ‘interfering in internal affairs’ - China has attacked Switzerland and 26 other countries for criticising a sweeping new national security law imposed on Hong Kong. Beijing denounced “political motivations” and “unjustified accusations”.,Jul 03 2020
CHF,"Vast tracts of pristine rainforest on three continents went up in smoke last year, with an area roughly the size of Switzerland cut down or burned to make way for cattle and commercial crops, researchers said Tuesday",Jun 02 2020
CHF,Switzerland freezes Angolan tycoon’s $900 million fortune,Aug 30 2020
CHF,US labels Switzerland a currency manipulator,Dec 18 2020
CHF,Switzerland gets ready to vote on ending free movement with EU,Sep 27 2020
CHF,"Switzerland puts entry restrictions on 29 countries to protect from coronavirus. The list includes the United States, Sweden, Brazil and Russia, which have been designated as countries with a high risk of infection",Jul 03 2020
CHF,"The Czech Republic has asked Germany, Switzerland and Poland to take in dozens of COVID-19 patients as the situation in its own hospitals has reached a critical point, Prague’s Health Ministry said.",Mar 06 2021
CHF,Switzerland referendum: Voters reject end to free movement with EU - projection,Sep 28 2020
CHF,US labels Switzerland a currency manipulator,Dec 17 2020
TWD,"Taiwan says WHO not sharing coronavirus information it provides, pressing complaints",Mar 31 2020
TWD,Czech mayor writes letter calling a Chinese diplomat an 'unmannered rude clown' and to apologize for his 'pathetic diplomatic f-ck up' after he threatens Czech Senate Speaker over Taiwan trip,Sep 01 2020
TWD,WHO accused of 'carrying China's water' after official refuses to acknowledge Taiwan during bizarre interview,Mar 29 2020
TWD,"Us secretary of state calls Taiwan ""country""",Mar 12 2021
TWD,"NZ foreign minister backs Taiwan's entry into WHO, bucks Beijing's bullying",May 06 2020
TWD,Trudeau thanks Taiwan directly for 'generous' mask donation,May 09 2020
TWD,China drops word 'peaceful' in latest push for Taiwan 'reunification',May 23 2020
TWD,"Taiwan will provide the people of Hong Kong with “necessary assistance”, President Tsai Ing-wen said, after a resurgence in protests in the Chinese ruled territory against newly proposed national security legislation from Beijing.",May 25 2020
TWD,Over 70% favor removing 'China' from Taiwan passport,Mar 31 2020
TWD,Biden raises coercion of Taiwan and human rights abuses with Xi Jinping in first phone call,Feb 11 2021
TWD,China to conduct major military drill simulating seizure of Taiwan-held island,May 15 2020
TWD,Australia to back Taiwan's return to the WHO,May 01 2020
TWD,Taiwan’s leader has called on residents to conserve water and prepare for shortages as the island faces worst drought in 56 years,Mar 08 2021
TWD,Declassified note shows U.S. intent to defend Taiwan against China,Mar 01 2021
TWD,"Taiwan has called on Australia to back its campaign to join the World Health Organisation, despite China's objections, arguing it has much to teach the world about tackling coronavirus.",Apr 29 2020
TWD,US approves $1.8bn weapons sale to Taiwan,Oct 23 2020
TWD,127 European politicians back Taiwan’s inclusion in the WHO,Apr 12 2020
TWD,China infuriated as Netherlands changes its representative office’s name in Taiwan,Apr 30 2020
TWD,"Taiwan fines man US$33,000 for breaking quarantine rule",Mar 24 2020
TWD,"Taiwan plans to donate 100,000 hospital masks to US per week",Mar 20 2020
TWD,Haiti thanks Taiwan for helping upgrade electricity grid,Sep 07 2020
TWD,Taiwan says WHO should 'free itself from' China's control,May 06 2020
TWD,"Taiwan offers masks and medical aid to foreign countries, angering Beijing",Apr 05 2020
TWD,Taiwan reveals email to WHO; didn't say human-to-human transmission,Apr 12 2020
TWD,Almost 40 Chinese warplanes breach Taiwan Strait median line; Taiwan President calls it a 'threat of force',Sep 22 2020
THB,Thailand Removes Cannabis from Narcotics List,Dec 01 2020
THB,"72% in Japan believe closure of illegal and unregulated animal markets in China and elsewhere would prevent pandemics like today’s from happening in future. WWF survey also shows 91% in Myanmar, 80% in Hong Kong, 79%in Thailand and 73% in Vietnam.",May 05 2020
THB,"Thailand’s top child modelling agent arrested after police discover half a million images of sex abuse | According to reports, the victims are all male minors aged between six and 15",Feb 18 2021
THB,Dozens of elephants in Thailand permanently freed from carrying tourists in the wake of COVID-19 downturn.,Mar 26 2020
THB,"Thailand Moves to Legalize Same-Sex Unions, a Rare Step in Asia",Jul 12 2020
THB,Researchers in Thailand have successfully trained six sniffer Labrador retrievers as part of a six-month pilot project to identify the coronavirus in just two seconds - with an accuracy rate of 94.8%,Mar 19 2021
THB,Thailand pushes cannabis as next cash crop,Feb 22 2021
THB,"Wet markets in China, Indonesia, Thailand, Vietnam, Cambodia and the Philippines are continuing to sell live and dead animals amid the COVID-19 pandemic",May 15 2020
THB,Thailand’s playboy king secretly rushed to hospital for 2am Covid test after bodyguard tests positive,Oct 24 2020
THB,"Hundreds of Captive Elephants are Freed for 'The Biggest Migration In Thailand's History'. When the COVID-19 pandemic brought collapse to tourism all across Thailand, funding ceased and keepers no longer had the resources to maintain the welfare of their elephants.",May 31 2020
THB,Thailand becomes first country to ban eating and drinking on domestic flights due to COVID-19,Dec 31 2020
THB,"Thailand's largest pro-democracy rally in years draws 10,000",Aug 17 2020
THB,Thailand blocks Change.org as petition against king gains traction,Oct 17 2020
THB,The people versus the King: Thailand's unprecedented revolt pits the people against the King.,Oct 15 2020
THB,"In recent weeks, rare leatherback turtles have been found nesting in numbers not seen for decades on beaches in Florida and Thailand. And experts say the resurgence of the vulnerable leatherback is likely closely linked to the desertion of beaches across the world due to the coronavirus pandemic.",Apr 21 2020
THB,King of Thailand Reportedly Accused of Breaking Sister’s Ankles After She Questions Plan to Name Second Queen,Jan 28 2021
THB,"Thailand to allow medical use of cocaine, opium and morphine",Nov 18 2020
THB,Water cannon used on protesters in Thailand,Oct 17 2020
THB,Thailand serves up cannabis cuisine to happy customers,Jan 16 2021
THB,Thailand's 'largest ketamine bust' turns out to be cleaning agent,Nov 25 2020
THB,Thailand's young pro-democracy protesters challenge military and monarchy. A young progressive movement in Thailand is demanding reform to the country's traditional political structure. They are up against a deeply entrenched alliance between the monarchy and the military.,Oct 18 2020
THB,Thailand pushes cannabis as next cash crop,Feb 23 2021
THB,Thai court hands out record 43-year jail term for insulting king | Thailand News,Jan 20 2021
THB,"Pro-democracy protesters in Thailand are daring to challenge the untouchable monarchy, and mocking their king who is hiding away in Germany. Pro-democracy protests have rumbled on for a month in Thailand, with calls for free elections and a new constitution.",Aug 18 2020
THB,"Coronavirus: King of Thailand Breaks Lockdown To Travel 12,000 Miles To Go To A Party",Apr 16 2020
TTD,Protests erupt on island nation of Trinidad after the killing of 3 unarmed men by police.,Jul 01 2020
TTD,Trinidad and Tobago deported 16 Venezuelan children in a boat: they are missing at sea,Nov 24 2020
TTD,Trinidad and Tobago on alert for potential collapse of Venezuelan oil tanker. The tank carries more than a million barrels of oil and may overturn in the Gulf of Paria.,Oct 20 2020
